226735829_1,Christ_POS_7358_1,We found it the busiest of all attractions visited during our four days in Rio .,September,2014,September,2014,Reynard1,New Zealand,Oceania,male,1,1,male,86
226735829_2,Christ_POS_7358_2,"Not that easy to mind around as people looked to take 's elfies , or reclining on the ground to get the best shot looking up at the statue .",September,2014,September,2014,Reynard1,New Zealand,Oceania,male,1,1,male,86
226735829_3,Christ_POS_7358_3,It is worth taking the train ride up the the top as this adds an extra dimension to the travel .,September,2014,September,2014,Reynard1,New Zealand,Oceania,male,4,2,male,86
226735829_4,Christ_POS_7358_4,"In the afternoon it us very difficult to get decent photos with the sun behind the statue this make us hard to get a car picture as the exposure compensates for the suns position , hence pix tend to be dark .",September,2014,September,2014,Reynard1,New Zealand,Oceania,male,1,1,male,86
226735829_5,Christ_POS_7358_5,"The morning , with the sun on the statue would have been much better .",September,2014,September,2014,Reynard1,New Zealand,Oceania,male,1,1,male,86
226073156_1,Christ_POS_7381_1,"Well , I visited the famous Cristo Redentor , and yes , it is beautiful .",November,2013,September,2014,Joseph D,Brazil,South America,male,4,2,male,7
226073156_2,Christ_POS_7381_2,"To get to the statue everybody has to go up some steps , and the authorities do not make any effort to control the flow of the crowds .",November,2013,September,2014,Joseph D,Brazil,South America,male,1,1,male,7
226073156_3,Christ_POS_7381_3,"So , what happens is there are too many people loaded on the upper steps , making it difficult , to say the least , to see the statue up close .",November,2013,September,2014,Joseph D,Brazil,South America,male,1,1,male,7
224377626_1,Christ_POS_7407_1,but go early in the morning before the starting point ( the train station ) is swarming with people .,August,2014,August,2014,jorn l,Colombia,South America,male,1,1,male,59
224377626_2,Christ_POS_7407_2,"It is possible to drive parts of the way and then Chang to small busses / taxis to get to the top , but seriously driving the little train is really a great experience .",August,2014,August,2014,jorn l,Colombia,South America,male,2,0,male,59
224377626_3,Christ_POS_7407_3,Gives a good perspective on the climb and chances to see monkeys and some nice nature .,August,2014,August,2014,jorn l,Colombia,South America,male,3,1,male,59
221147120_1,Christ_POS_7471_1,I am not sure why you would come to Rio and not see this but it is a must do .,August,2014,August,2014,Nadya R,Canada,North America,male,1,1,female,91
221147120_2,Christ_POS_7471_2,"The train ride up is quaint , sit on the side closest to the platform for the best views .",August,2014,August,2014,Nadya R,Canada,North America,male,3,1,female,91
221147120_3,Christ_POS_7471_3,Go in the morning for the clearest views of the city .,August,2014,August,2014,Nadya R,Canada,North America,male,2,0,female,91
219758848_1,Christ_POS_7495_1,"As often happens with these things , you turn up to see something world famous ( the statue ) and it is a bit underwhelming .",March,2014,August,2014,LauraCbo,United Kingdom,Europe,male,1,1,female,9
219758848_2,Christ_POS_7495_2,"it is a very nice statue , but in person it is smaller than you expect .",March,2014,August,2014,LauraCbo,United Kingdom,Europe,male,3,1,female,9
219758848_3,Christ_POS_7495_3,The reason you have to go here is the view - it is simply stunning .,March,2014,August,2014,LauraCbo,United Kingdom,Europe,male,3,1,female,9
219758848_4,Christ_POS_7495_4,And if you are new to Rio it is actually a really good way to get your bearings .,March,2014,August,2014,LauraCbo,United Kingdom,Europe,male,3,1,female,9
219758848_5,Christ_POS_7495_5,"it is much higher than Sugar Loaf Mountain , so if you are only going to do one of the two , I would recommend this .",March,2014,August,2014,LauraCbo,United Kingdom,Europe,male,1,1,female,9
219758848_6,Christ_POS_7495_6,"Little tip - if you can go up just before the sun is setting , you will get lovely daytime pictures and can hang out and wait for it to set , and then see Rio's lights come alive before you .",March,2014,August,2014,LauraCbo,United Kingdom,Europe,male,1,1,female,9
219186910_1,Christ_POS_7513_1,The best part of this attraction was the breathtaking views of Rio .,September,2013,August,2014,Carlos M,Australia,Oceania,male,3,1,male,65
219186910_2,Christ_POS_7513_2,Having the opportunity to see the statue up close was an amazing experience .,September,2013,August,2014,Carlos M,Australia,Oceania,male,4,2,male,65
216957994_1,Christ_POS_7563_1,"The trip up was quite involved with a mixture of taxi ride , queues , buses and more queues - but considering we were in Rio de Janeiro during the World Cup , they managed very well .",July,2014,July,2014,Rosie006,Australia,Oceania,male,3,1,female,6
216957994_2,Christ_POS_7563_2,Good value eating at the cafe at the top surprisingly - with stunning views over Guanabara Bay and Rio !,July,2014,July,2014,Rosie006,Australia,Oceania,male,4,2,female,6
215514802_1,Christ_POS_7618_1,The getting to it is a bit of an issue though .,June,2014,July,2014,AnnePret,South Africa,Africa,male,1,1,female,7
215514802_2,Christ_POS_7618_2,"We went up on a saturday morning - the train was completely full and could only take us up that evening , so we took the shuttle to the midway stop .",June,2014,July,2014,AnnePret,South Africa,Africa,male,1,1,female,7
215514802_3,Christ_POS_7618_3,Upon arrival they told us the ticket centre is closed for the next 3 hours as there are too many people .,June,2014,July,2014,AnnePret,South Africa,Africa,male,1,1,female,7
215514802_4,Christ_POS_7618_4,This was highly frustrating as we had already spent about $ R 50 to get midway .,June,2014,July,2014,AnnePret,South Africa,Africa,male,1,1,female,7
215514802_5,Christ_POS_7618_5,No one at the bottom tells you that it is full .,June,2014,July,2014,AnnePret,South Africa,Africa,male,3,1,female,7
215514802_6,Christ_POS_7618_6,We eventually booked a tour a couple of days later wihch at least guarantees you a spot to the redeemer but you still need to stand in the queues .,June,2014,July,2014,AnnePret,South Africa,Africa,male,1,1,female,7
215514802_7,Christ_POS_7618_7,If you have a bit of money to spend I would recommned the helicopter flight .,June,2014,July,2014,AnnePret,South Africa,Africa,male,1,1,female,7
215425753_1,Christ_POS_7625_1,The view of Rio from the top of Corcovado is spectacular .,March,2014,July,2014,DanJamLondon,United Kingdom,Europe,male,3,1,male,86
215425753_2,Christ_POS_7625_2,"I would recommend getting up to the top early - as even at 8am , it was busier than I thought it would be .",March,2014,July,2014,DanJamLondon,United Kingdom,Europe,male,1,1,male,86
214935075_1,Christ_POS_7639_1,"You have to stand in a bunch of lines , but I promise it is worth it !",,,July,2014,JanB420,Sweden,Europe,male,3,1,male,66
214935075_2,Christ_POS_7639_2,"How you get up does not really matter , minibus , the fernicular , cab , ( long ) walk or your own car ( parking might be complicated did not matter , one you are up there it is just beautiful .",,,July,2014,JanB420,Sweden,Europe,male,1,1,male,66
214935075_3,Christ_POS_7639_3,"You can see Ipanema , Copacabana , sugarloaf mountain , Maracan , Cristo Redentor ( of course ) and much more .",,,July,2014,JanB420,Sweden,Europe,male,1,1,male,66
214935075_4,Christ_POS_7639_4,I would not even call it a tourist trap despite the location .,,,July,2014,JanB420,Sweden,Europe,male,1,1,male,66
214935075_5,Christ_POS_7639_5,I recommend eating there to have even more time to enjoy the place .,,,July,2014,JanB420,Sweden,Europe,male,3,1,male,66
214896430_1,Christ_POS_7642_1,"Nice views of the city but too crowded , screaming guides ushering the people .",July,2014,July,2014,Margarita703,United Kingdom,Europe,female,1,1,female,70
214896430_2,Christ_POS_7642_2,"If they have the policy of allowing certain number of people a day , I wonder why they do not control that in a better way .",July,2014,July,2014,Margarita703,United Kingdom,Europe,female,1,1,female,70
214896430_3,Christ_POS_7642_3,The space around the Christ is too small to handle 200 people trying to take a photos and hearing the noisy guides .,July,2014,July,2014,Margarita703,United Kingdom,Europe,female,1,1,female,70
214896430_4,Christ_POS_7642_4,Vey hard too to try to squezzy by the rails to have a look at the city .,July,2014,July,2014,Margarita703,United Kingdom,Europe,female,1,1,female,70
214601652_1,Christ_POS_7654_1,Arrived cosme velho ( base where tram is ) at 815am .,June,2014,July,2014,Wes R,Australia,Oceania,male,1,1,male,6
214601652_2,Christ_POS_7654_2,Just followed the plethora of vans which took tourists to the car park near the top .,June,2014,July,2014,Wes R,Australia,Oceania,male,1,1,male,6
214601652_3,Christ_POS_7654_3,From the carpark you can only get a van or the tram the last part .,June,2014,July,2014,Wes R,Australia,Oceania,male,1,1,male,6
214601652_4,Christ_POS_7654_4,"So got on the tram at 1020am , no waiting , even though my ticket was for 1115am .",June,2014,July,2014,Wes R,Australia,Oceania,male,1,1,male,6
214601652_5,Christ_POS_7654_5,Need to climb around 200 steps to the top or get a lift up .,June,2014,July,2014,Wes R,Australia,Oceania,male,2,0,male,6
214601652_6,Christ_POS_7654_6,"The walk up passes some lovely big homes , great views of Rio , passing through beautiful rainforest .",June,2014,July,2014,Wes R,Australia,Oceania,male,3,1,male,6
214601652_7,Christ_POS_7654_7,Footpath 50 % of the walk but road is wide enough to feel perfectly safe .,June,2014,July,2014,Wes R,Australia,Oceania,male,3,1,male,6
214601652_8,Christ_POS_7654_8,Took some nice photos of the Cristo Redentor on the way up as well as the tram and the favela on the hillside .,June,2014,July,2014,Wes R,Australia,Oceania,male,3,1,male,6
214601652_9,Christ_POS_7654_9,"Only steep in first section otherwise pretty good gradient , just take your time .",June,2014,July,2014,Wes R,Australia,Oceania,male,1,1,male,6
214601652_10,Christ_POS_7654_10,"Of course , view of the statue is breathtaking and awe inspiring , enhanced by the effort of the walk up .",June,2014,July,2014,Wes R,Australia,Oceania,male,3,1,male,6
214154414_1,Christ_POS_7679_1,"Try to avoid high season , it is very crowded and you will find difficulties to take good pictures ( if that is what you want to do ) .",June,2014,July,2014,MataIvan,Mexico,North America,male,1,1,female,6
213997967_1,Christ_POS_7685_1,The Christo is one of the most amazing things iv ever seen !,,,July,2014,RudiD534,Portugal,Europe,male,4,2,male,7
213997967_2,Christ_POS_7685_2,"It was one of my best days in my life to be able to stand under it , see Rio from up there & see the the Maracana stadium I highly recommend it , in fact if you do not go to see it , it is like going to Paris & not going to see the Eiffel Tower .",,,July,2014,RudiD534,Portugal,Europe,male,3,1,male,7
213619024_1,Christ_POS_7706_1,We did the trip up to the top earlish - about 9AM so fortunately it was not too busy .,April,2014,July,2014,PietiePie,United Kingdom,Europe,female,1,1,female,9
213619024_2,Christ_POS_7706_2,Of course the view is great and the statue is impressive .,April,2014,July,2014,PietiePie,United Kingdom,Europe,female,3,1,female,9
213619024_3,Christ_POS_7706_3,But once you have taken the obligatory pic and soaked up the view .,April,2014,July,2014,PietiePie,United Kingdom,Europe,female,2,0,female,9
213619024_4,Christ_POS_7706_4,There is not much peace and quite like Sugar loaf can offer .,April,2014,July,2014,PietiePie,United Kingdom,Europe,female,1,1,female,9
213259197_1,Christ_POS_7733_1,You can drive up there to a certain point but than you have to either take a train or a mini bus .,August,2013,July,2014,RizwanR_13,United Kingdom,Europe,female,1,1,male,8
213259197_2,Christ_POS_7733_2,Best bet is go with a tour company but they charge a lot compared to if you went in your own car .,August,2013,July,2014,RizwanR_13,United Kingdom,Europe,female,3,1,male,8
212251850_1,Christ_POS_7779_1,"Went there during the time of the world cup , so you can imagine the amount of people at the site .",June,2014,June,2014,karla014,Mexico,North America,female,3,1,female,88
212251850_2,Christ_POS_7779_2,"We got there using one of the mini buses that leave from a park near the Largo de Machado metro station and it was the best thing that we could have done since this mini buses take you directly to the entrance , people arriving / leaving on the tram had to wait almost an hour to go back down .",June,2014,June,2014,karla014,Mexico,North America,female,1,1,female,88
211904576_1,Christ_POS_7786_1,Amazing views - very busy - go early to make sure you can get on the train - otherwise you have to queue for a ticket for the bus then queue for the bus !,June,2014,June,2014,KennethV374,United Kingdom,Europe,male,1,1,male,7
211771208_1,Christ_POS_7792_1,"it is one of those icons in Rio that you just have to see , but once up there and you have taken the pictures , you wonder to yourself , now what ?",,,June,2014,Chunlian,Singapore,Asia,male,3,1,female,97
211771208_2,Christ_POS_7792_2,It would have been better if there were more things there than just souvenir shops and cafs .,,,June,2014,Chunlian,Singapore,Asia,male,1,1,female,97
211771208_3,Christ_POS_7792_3,Transport was convenient as we booked via this website - https tickets .,,,June,2014,Chunlian,Singapore,Asia,male,1,1,female,97
211771208_4,Christ_POS_7792_4,"br / they have a few pickup locations , the one we went to was at Lido Square on Copacabana .",,,June,2014,Chunlian,Singapore,Asia,male,1,1,female,97
211771208_5,Christ_POS_7792_5,"They provide you the transport there , and you can leave anytime you want as their vans were rather frequent .",,,June,2014,Chunlian,Singapore,Asia,male,1,1,female,97
211771208_6,Christ_POS_7792_6,"it is not as amazing when you see it in real life , but since it is one of the major icons in Rio ( the other being Sugar Loaf you just have to make the trip there .",,,June,2014,Chunlian,Singapore,Asia,male,1,1,female,97
211650164_1,Christ_POS_7795_1,Make a reservation online or go the kiosk at the train station and get a ticket for a designated time .,June,2014,June,2014,Lisa B,Georgia,Asia,male,2,0,female,72
211650164_2,Christ_POS_7795_2,We showed up 20 minutes early and were able to get on the train that was just about to leave no line !,June,2014,June,2014,Lisa B,Georgia,Asia,male,1,1,female,72
211650164_3,Christ_POS_7795_3,The train ride takes around 20-25 minutes and is very scenic .,June,2014,June,2014,Lisa B,Georgia,Asia,male,3,1,female,72
211650164_4,Christ_POS_7795_4,"There are gift shops , restaurants , and clean bathrooms on the mountain .",June,2014,June,2014,Lisa B,Georgia,Asia,male,3,1,female,72
211650164_5,Christ_POS_7795_5,We were lucky that we went on a relatively clear day .,June,2014,June,2014,Lisa B,Georgia,Asia,male,1,1,female,72
211650164_6,Christ_POS_7795_6,We went in the morning on a saturday the crowds were not too bad .,June,2014,June,2014,Lisa B,Georgia,Asia,male,1,1,female,72
211650164_7,Christ_POS_7795_7,"Waiting for the train to go back down took awhile , but that is status quo for attractions that are wildly famous and popular .",June,2014,June,2014,Lisa B,Georgia,Asia,male,3,1,female,72
210831562_1,Christ_POS_7814_1,"Despite the lines , the difficult access and parking , the food price and sometimes very crowded , this is a must and the views are just out of this world .",,,June,2014,87ruis,Portugal,Europe,male,1,1,male,85
208328090_1,Christ_POS_7847_1,What an amazing opportunity to see a modern wonder of the world .,May,2014,June,2014,beren00,France,Europe,male,4,2,male,61
208328090_2,Christ_POS_7847_2,"it is a little bit of work to get up there and the cab ride is not for the faint of heart , but the final steps to the top are worth the effort .",May,2014,June,2014,beren00,France,Europe,male,3,1,male,61
208328090_3,Christ_POS_7847_3,It is a commanding view of Rio and a once in a lifetime opportunity .,May,2014,June,2014,beren00,France,Europe,male,3,1,male,61
208266534_1,Christ_POS_7849_1,This is definitely a must-see in Rio that I can never get tired of !,April,2014,June,2014,Evelyn B,Venezuela,South America,male,0,2,female,98
208266534_2,Christ_POS_7849_2,"it is a simple and wonderful place with awesome views of the city , My recommendation is to always check the weather forecast and make sure it is a sunny / clear day , Book ahead on http www .",April,2014,June,2014,Evelyn B,Venezuela,South America,male,4,2,female,98
208266534_3,Christ_POS_7849_3,"br / My favorite time to go is early in the morning , preferably on the first ride up !",April,2014,June,2014,Evelyn B,Venezuela,South America,male,3,1,female,98
205429460_1,Christ_POS_7908_1,"it is amazing , it is great , it is one of the seven wonders !",April,2014,May,2014,HelderBCarvalho,Portugal,Europe,male,4,2,male,71
205429460_2,Christ_POS_7908_2,You must arriveearly in order for not loosing too much time in the queues .,April,2014,May,2014,HelderBCarvalho,Portugal,Europe,male,2,0,male,71
205427333_1,Christ_POS_7909_1,"it is big , it is amazing it is a seven wonder !",April,2014,May,2014,HelderBCarvalho,Portugal,Europe,female,4,2,male,71
205427333_2,Christ_POS_7909_2,You must get there early so that you do not get to much queues .,April,2014,May,2014,HelderBCarvalho,Portugal,Europe,female,2,0,male,71
204930850_1,Christ_POS_7919_1,"Made our own way cheaper by Taxi and could be there for as long as we wanted , go early morning to beat the crowds , lie on the floor to take a photo of the whole statue .",December,2013,May,2014,Pauline P,United Kingdom,Europe,female,1,1,female,71
204150956_1,Christ_POS_7929_1,"We booked train tickets online , we wanted to make sure we got a good view and we did not want to go with the crowds , so we booked the first train possible .",January,2014,May,2014,Lucy122014,United Kingdom,Europe,male,3,1,female,8
204150956_2,Christ_POS_7929_2,"they are were only 8 other people on the first train , so we got incredible photos and felt like we were the only visitors to see Christ .",January,2014,May,2014,Lucy122014,United Kingdom,Europe,male,3,1,female,8
204150956_3,Christ_POS_7929_3,"Get up early make , the effort you will not regret it , we were back at our hotel for a late breakfast !",January,2014,May,2014,Lucy122014,United Kingdom,Europe,male,1,1,female,8
200914190_1,Christ_POS_7996_1,I sure was lucky that I picked a sunny and clear day so I saw everything around me .,,,April,2014,87ruis,Portugal,Europe,female,3,1,male,85
200914190_2,Christ_POS_7996_2,"The access is the down part , specially by car but its worth every minute .",,,April,2014,87ruis,Portugal,Europe,female,3,1,male,85
200684013_1,Christ_POS_8001_1,"We went by minibus , not on the train which was slightly disappointing .",March,2014,April,2014,julia h,United Kingdom,Europe,female,1,1,female,67
200684013_2,Christ_POS_8001_2,"We had cloud that was tantalising us , clearing and then coming back .",March,2014,April,2014,julia h,United Kingdom,Europe,female,1,1,female,67
200684013_3,Christ_POS_8001_3,"The Christ statue is beautiful , the face is calm just as one would imagine Jesus to be .",March,2014,April,2014,julia h,United Kingdom,Europe,female,3,1,female,67
200684013_4,Christ_POS_8001_4,This is a trip you must not miss when in Rio .,March,2014,April,2014,julia h,United Kingdom,Europe,female,2,0,female,67
199511982_1,Christ_POS_8029_1,"being under this marvelous structure after seeing it hundreds of times in pictures , is amazing .",March,2014,April,2014,carlos_manuelsr,Puerto Rico,North America,male,3,1,male,67
199511982_2,Christ_POS_8029_2,"make sure you visit it during a sunny and clear day , otherwise you will miss the great view .",March,2014,April,2014,carlos_manuelsr,Puerto Rico,North America,male,3,1,male,67
199511982_3,Christ_POS_8029_3,"besides try to go with time , the visit will take you at least 2-3 hours , and during the afternoon , the sunset is spectacular .",March,2014,April,2014,carlos_manuelsr,Puerto Rico,North America,male,2,0,male,67
198232687_1,Christ_POS_8053_1,"Best to go with a tour company , that way you will not need to endure the long lineups .",March,2014,March,2014,Peter T,Canada,North America,male,3,1,male,63
198232687_2,Christ_POS_8053_2,They had scaffolding up part of it when we were there but still interesting .,March,2014,March,2014,Peter T,Canada,North America,male,2,0,male,63
198232687_3,Christ_POS_8053_3,The view from here is spectacular out onto the ocean beaches and Rio .,March,2014,March,2014,Peter T,Canada,North America,male,3,1,male,63
198232687_4,Christ_POS_8053_4,Be prepared for a shoulder to shoulder experience at the top as the viewing area is very small considering the amount of people .,March,2014,March,2014,Peter T,Canada,North America,male,3,1,male,63
198232687_5,Christ_POS_8053_5,The winding road to the top of Corcovado is an experience in itself maneuvering around countless switchbacks to the top .,March,2014,March,2014,Peter T,Canada,North America,male,1,1,male,63
198232687_6,Christ_POS_8053_6,We were told we might be taking the train up the hill but I get a feeling that might never happen .,March,2014,March,2014,Peter T,Canada,North America,male,1,1,male,63
197309665_1,Christ_POS_8077_1,"The train ride up through the rainforest was interesting , seeing the trees and flowers up close .",February,2014,March,2014,RosieCanberra,Australia,Oceania,male,3,1,female,79
197309665_2,Christ_POS_8077_2,The rain started when we got up there but eased enough for some good photos to be taken .,February,2014,March,2014,RosieCanberra,Australia,Oceania,male,2,0,female,79
197309665_3,Christ_POS_8077_3,"The views over Rio were not as good as from Sugar Loaf due to the weather , but it was good to see the statue up close .",February,2014,March,2014,RosieCanberra,Australia,Oceania,male,3,1,female,79
197309665_4,Christ_POS_8077_4,You do not realise how high it is until you get to Rio .,February,2014,March,2014,RosieCanberra,Australia,Oceania,male,1,1,female,79
196119822_1,Christ_POS_8114_1,Well you have to go to tick the box if nothing else .,February,2014,March,2014,ade74,United Kingdom,Europe,female,2,0,male,75
196119822_2,Christ_POS_8114_2,You get to stop on the way and get some good views of Rio but to be honest I wished I just got the tram .,February,2014,March,2014,ade74,United Kingdom,Europe,female,1,1,male,75
194436145_1,Christ_POS_8150_1,The option to go up by train had it is charm even if it is the longer way up and down .,February,2014,February,2014,Katharina19,Japan,Asia,male,3,1,female,72
194436145_2,Christ_POS_8150_2,"do not walk away even if you have a ticket for a later time slot , they always fill up the train and we hopped on one which left 40 minutes earlier than our ticket .",February,2014,February,2014,Katharina19,Japan,Asia,male,1,1,female,72
193627201_1,Christ_POS_8173_1,"If you go early in the morning ( before 8.30 am ) by taxi to avoid the crowds , there will be no waiting time for the minibus plus the elevator ( to go up the last bit to the Christ viewpoint .",January,2014,February,2014,eelco2013,Netherlands,Europe,male,1,1,male,92
193627201_2,Christ_POS_8173_2,But make sure it is a clear morning with no clowds !,January,2014,February,2014,eelco2013,Netherlands,Europe,male,1,1,male,92
193363187_1,Christ_POS_8177_1,One of the best places I have ever seen in my lifetime .,March,2013,February,2014,Chantelle V,Spain,Europe,female,3,1,female,6
192703891_1,Christ_POS_8202_1,"If you are in Rio , you have to go there .",January,2014,January,2014,Dieter R,Canada,North America,female,2,0,male,76
192703891_2,Christ_POS_8202_2,"I guess , It is always very busy up there , with people lying around , trying to take pictures of friends in front of the big dude .",January,2014,January,2014,Dieter R,Canada,North America,female,1,1,male,76
192703891_3,Christ_POS_8202_3,"It is a bit awkward to get train tickets for corcovado , because you have to go on the web before .",January,2014,January,2014,Dieter R,Canada,North America,female,1,1,male,76
192701109_1,Christ_POS_8203_1,Did this on the same day as Sugar Loaf and we were so lucky that the weather was sunny and perfect .,January,2014,January,2014,girlie30,United Kingdom,Europe,female,2,0,female,94
192701109_2,Christ_POS_8203_2,Gets very busy - the train was hot and crowded but definitely worth the trip .,January,2014,January,2014,girlie30,United Kingdom,Europe,female,3,1,female,94
192701109_3,Christ_POS_8203_3,Where the train ends there are escalators and lifts if you can not manage the numerous steps right to the top .,January,2014,January,2014,girlie30,United Kingdom,Europe,female,1,1,female,94
192701109_4,Christ_POS_8203_4,There is a small chapel inside the lower portion of the statue .,January,2014,January,2014,girlie30,United Kingdom,Europe,female,1,1,female,94
191219936_1,Christ_POS_8258_1,"The views are incredible getting there is an interesting experience just get a taxi the train was not working when we arrived so the taxi took us right near the top where you get a ticket to catch up bus up the remainder of the way , some improved signage would be good !",January,2014,January,2014,beno77,Australia,Oceania,male,3,1,male,70
190484819_1,Christ_POS_8280_1,a long drive up to join a huge crowd that spoiled the trip .,December,2013,January,2014,Paul H,United Kingdom,Europe,male,2,0,male,86
190484819_2,Christ_POS_8280_2,"But amazing nonetheless , Queuing for the lift is a pain .",December,2013,January,2014,Paul H,United Kingdom,Europe,male,3,1,male,86
