541795278_2,Christ_POS_1729_2,"After the hour or so trying all sorts of different photo poses with the statue in the background , spend some time overlooking the city and then meandering to the chapel to the back of the statue and taking the stairs down to get a good view of Ipanema and Leblon .",November,2017,November,2017,Jeff_Proulx,Canada,North America,female,1,1,male,92
541795278_3,Christ_POS_1729_3,We took UBER to get there and only found out at 17:00 that UBER and taxis do not come to to the mountain at that time as they are busy in town .,November,2017,November,2017,Jeff_Proulx,Canada,North America,female,1,1,male,92
541795278_4,Christ_POS_1729_4,It thus cost us a bit more as we had to take one of the transfers from the mountain and then take UBER to get us back to Ipanema .,November,2017,November,2017,Jeff_Proulx,Canada,North America,female,1,1,male,92
541795278_5,Christ_POS_1729_5,"While there , we found out that there are buses leaving Copacabana for R $ 35 per person that include access to the statue - that would now be my choice if I were to go back , .",November,2017,November,2017,Jeff_Proulx,Canada,North America,female,1,1,male,92
541009118_1,Christ_POS_1743_1,"apart from all the ridiculous people taking selfies , it is a magnificent place , view , and sculpture !",December,2016,November,2017,JulienParisLondonMad,France,Europe,male,3,1,male,9
541004830_1,Christ_POS_1744_1,"That , added to the fact that is placed on a rocky outcrop high above Rio makes it a world class attraction .",November,2017,November,2017,Alan H,United Kingdom,Europe,male,3,1,male,91
541004830_2,Christ_POS_1744_2,The views are unbelievable and the infrastructure to handle the crowds of visitors is very good .,November,2017,November,2017,Alan H,United Kingdom,Europe,male,3,1,male,91
541004830_3,Christ_POS_1744_3,Half of the attraction would be lost on a cloudy day but it is pot luck .,November,2017,November,2017,Alan H,United Kingdom,Europe,male,1,1,male,91
541004830_4,Christ_POS_1744_4,We went early ( arrived at 8 am ) and beat the crowds .,November,2017,November,2017,Alan H,United Kingdom,Europe,male,1,1,male,91
540192177_1,Christ_POS_1757_1,Well I do think all knows that this is a must see in Rio .,November,2017,November,2017,JokkeNu,Lithuania,Europe,female,2,0,male,61
540192177_2,Christ_POS_1757_2,Great views of the city and of course great photos of the statue .,November,2017,November,2017,JokkeNu,Lithuania,Europe,female,3,1,male,61
536692516_1,Christ_POS_1803_1,"When alone it is nicer to take the mountain train - for which we did not have the time ( flights do not wait , ) .",October,2017,October,2017,Philip P,Belgium,Europe,male,1,1,male,81
536692516_2,Christ_POS_1803_2,"At the arrival a lot of stairs , and a very convenient elevator !",October,2017,October,2017,Philip P,Belgium,Europe,male,3,1,male,81
534073175_1,Christ_POS_1833_1,"Ok , it goes without saying , if in Rio you must go .",October,2017,October,2017,SouBru,Georgia,Asia,female,1,1,female,78
534073175_2,Christ_POS_1833_2,This is the top spot to see all of Rio and be impressed by this incredible vision of Christ the Redeemer .,October,2017,October,2017,SouBru,Georgia,Asia,female,4,2,female,78
534073175_3,Christ_POS_1833_3,"Pick a good day , go early , enjoy the train ride getting there and enjoy the view .",October,2017,October,2017,SouBru,Georgia,Asia,female,4,2,female,78
531664545_1,Christ_POS_1852_1,The day we went it was very busy and the tram was full so once at the top it was really hectic .,September,2017,October,2017,David C,United Kingdom,Europe,female,1,1,male,83
531664545_2,Christ_POS_1852_2,That said it is an awesome sight and one you really must not miss .,September,2017,October,2017,David C,United Kingdom,Europe,female,1,1,male,83
531664545_3,Christ_POS_1852_3,"There are plenty of facilities up there for getting drinks , food , tacky souvenirs etc etc .",September,2017,October,2017,David C,United Kingdom,Europe,female,1,1,male,83
531183118_1,Christ_POS_1856_1,"I tool an uber to the train station , then the train to the elevator / stairs , took the stairs up .",September,2017,October,2017,Kim L,Canada,North America,male,1,1,female,86
531183118_2,Christ_POS_1856_2,"It was busy as there was some kind of religious event going on , it was 3pm and a very sunny day so the Christ was a silhouette but still looked impressive .",September,2017,October,2017,Kim L,Canada,North America,male,1,1,female,86
531183118_3,Christ_POS_1856_3,We were lucky to have a sunny day so the trip up was worth it .,September,2017,October,2017,Kim L,Canada,North America,male,3,1,female,86
530624631_1,Christ_POS_1865_1,I arrived at the train station in a wheelchair there was priority boarding special ramps and places to sit very comfortable .,September,2017,October,2017,Rosie D,United Kingdom,Europe,male,1,1,female,6
530624631_2,Christ_POS_1865_2,On arrival 2 men came specially trained to help me up the escalator at the top I could success every floor it was marvellous .,September,2017,October,2017,Rosie D,United Kingdom,Europe,male,3,1,female,6
522704029_1,Christ_POS_1939_1,Is it any wonder that Christ the Redeemer at the top of Corcovado is one of the wonders of the world .,July,2017,September,2017,Bruce H,Australia,Oceania,female,3,1,male,737
522704029_2,Christ_POS_1939_2,It is an iconic sight to see from around Rio de Janeiro but exceptional close up where you can appreciate the enormity and wonder of the statue .,July,2017,September,2017,Bruce H,Australia,Oceania,female,3,1,male,737
522240314_1,Christ_POS_1941_1,This is the second time I have been fortunate enough to go to see Christ the Redeemer and I have to say that it is just as impressive now as it was 15 years ago .,August,2017,September,2017,Jasna A,United Kingdom,Europe,male,1,1,female,6
522240314_2,Christ_POS_1941_2,I did it as part of the tour and instead of waiting in the big queues for the tram to take you up we drove through some of the national park to a certain point where we were driven up to the entrance .,August,2017,September,2017,Jasna A,United Kingdom,Europe,male,1,1,female,6
522240314_3,Christ_POS_1941_3,It can get very busy and congested up at the statue and the earlier you can get there the better to avoid all the hustle and bustle .,August,2017,September,2017,Jasna A,United Kingdom,Europe,male,1,1,female,6
522240314_4,Christ_POS_1941_4,Overall it is a must for anyone travelling to the city and it is definitely something you will always remember .,August,2017,September,2017,Jasna A,United Kingdom,Europe,male,3,1,female,6
521713668_1,Christ_POS_1946_1,"Good to see it at least once , however it is packed with tourists .",September,2017,September,2017,255FlorinB,Netherlands,Europe,male,3,1,male,7
521713668_2,Christ_POS_1946_2,The views are very nice ( but best views are at Dois Irmaos ) Super easy to get up but a bit pricey .,September,2017,September,2017,255FlorinB,Netherlands,Europe,male,3,1,male,7
519155634_1,Christ_POS_1961_1,"Totally amazing place to visit , it is HUGE and made from mosaic tiles !",June,2017,August,2017,trina027,Australia,Oceania,male,3,1,female,79
519155634_2,Christ_POS_1961_2,There is also a chapel with small services / prayers happening regularly .,June,2017,August,2017,trina027,Australia,Oceania,male,1,1,female,79
519155634_3,Christ_POS_1961_3,it is a VERY busy place with many people taking pictures BUT everyone is happy to help / move a bit and generally enjoying the view and atmosphere .,June,2017,August,2017,trina027,Australia,Oceania,male,4,2,female,79
519155634_4,Christ_POS_1961_4,It can be COLD so take a jumper / jacket / cardigan .,June,2017,August,2017,trina027,Australia,Oceania,male,1,1,female,79
513945740_1,Christ_POS_1993_1,You are in Rio and what else to do except drinking Margaritas on the beach .,May,2017,August,2017,MarianaFFM069,Germany,Europe,male,1,1,female,75
513945740_2,Christ_POS_1993_2,It is a world wonder and it is definitely worth seeing .,May,2017,August,2017,MarianaFFM069,Germany,Europe,male,4,2,female,75
513945740_3,Christ_POS_1993_3,We took a cab and then the bus to the entrance if I remember good .,May,2017,August,2017,MarianaFFM069,Germany,Europe,male,1,1,female,75
513945740_4,Christ_POS_1993_4,"Once you get up it is quite crowdy , to be honest .",May,2017,August,2017,MarianaFFM069,Germany,Europe,male,3,1,female,75
513046839_1,Christ_POS_2000_1,"So good in the flesh Great statue , views and ride up to the site .",July,2017,August,2017,PaulMiller1976,United Kingdom,Europe,male,3,1,male,9
506542507_1,Christ_POS_2047_1,This is a truly amazing experience not just standing at the base of one of the seven wonders of the world but also the ability to take in the panoramic views of the whole of Rio .,July,2017,July,2017,Petronella R,Australia,Oceania,male,4,2,female,8
506542507_2,Christ_POS_2047_2,It is important that you predict the weather as best you can before visiting the the Carcovado as I have been before on a misty day and was not able to see the statue and / ot the surrounding views .,July,2017,July,2017,Petronella R,Australia,Oceania,male,1,1,female,8
503798878_1,Christ_POS_2065_1,do not pre book in case you can not see anything which happens regularly .,March,2017,July,2017,Vicky S,Australia,Oceania,female,1,1,female,60
501664097_1,Christ_POS_2080_1,We arrived at 7.30 am with precooked tickets to ride the first train up at 8.20 am .,July,2017,July,2017,Ruth C,Australia,Oceania,male,1,1,female,90
501664097_2,Christ_POS_2080_2,"Very few people and beautiful clear sky , followed by clouds rolling in and engulfing us .",July,2017,July,2017,Ruth C,Australia,Oceania,male,3,1,female,90
501664097_3,Christ_POS_2080_3,"Later when we went back down there were lots and lots of people and we were so glad we made the decision to see it early , thanks to Tripadvisor reviews and advice .",July,2017,July,2017,Ruth C,Australia,Oceania,male,1,1,female,90
500178070_1,Christ_POS_2098_1,"Visited Christ the Redeemer on 20th May 2017 with two Brazil and one Indian Friend , Visited on the day when it was very much cloudy .",May,2017,July,2017,shashikantK1967,India,Asia,female,1,1,male,6
500178070_2,Christ_POS_2098_2,Before you buy the Tickets you are provided with the TV screen of the current View - whether you can see the statue or not on the Screen we were not able to see anything on the screen but then we have decided to go up the Hill and see .,May,2017,July,2017,shashikantK1967,India,Asia,female,1,1,male,6
500178070_3,Christ_POS_2098_3,"when we reached at the Top , we were hardly able to see any view of the statue due to clouds , It was not clear but after some time clouds went away and we have seen the full statue .",May,2017,July,2017,shashikantK1967,India,Asia,female,1,1,male,6
489568922_1,Christ_POS_2189_1,"Once you are there , you can enjoy the great views of Rio .",May,2017,June,2017,Megi68,Canada,North America,female,3,1,female,90
488151746_1,Christ_POS_2199_1,"This is one of the things that everyone wants to do in Rio but if you want to see Christ the Redeemer , then honestly this is better done from a distance .",May,2017,May,2017,525VickiC,United Kingdom,Europe,male,1,1,female,58
488151746_2,Christ_POS_2199_2,The views over Rio from the top of Corcovado ( and on the railway on the way up ) are however spectacular .,May,2017,May,2017,525VickiC,United Kingdom,Europe,male,3,1,female,58
488151746_3,Christ_POS_2199_3,"Luckily we were there towards the end of the main tourist season , so was not horrendously busy but I can imagine it gets really crowded on a nice day .",May,2017,May,2017,525VickiC,United Kingdom,Europe,male,3,1,female,58
488151746_4,Christ_POS_2199_4,"There is a lift from the train stop to the top , or a few sets of easy steps if you prefer , and a couple of cafes and gift shops on the top too .",May,2017,May,2017,525VickiC,United Kingdom,Europe,male,3,1,female,58
486196245_1,Christ_POS_2210_1,It is quite a hike although they do have some disability accessibility .,January,2017,May,2017,FiveStarPrincessDoes,Canada,North America,male,2,0,male,64
482506280_1,Christ_POS_2264_1,"you can access this beautiful place by tramva or walking , but i suggest tramva because you go from inside the jungle .",February,2017,May,2017,mohammad k,Iran,Asia,male,2,0,male,9
482506280_2,Christ_POS_2264_2,in this place you have a good view of all RIO and also can take a unforgettable picture with this great beautiful hand made .,February,2017,May,2017,mohammad k,Iran,Asia,male,4,2,male,9
479457808_1,Christ_POS_2294_1,"It takes a lot of patience to get there , but once you have completed the 220 steps your jaws will drop .",April,2017,April,2017,AstridBharos,Netherlands,Europe,female,1,1,female,8
479237357_1,Christ_POS_2302_1,"There are several to get there , we chose to get there by bus .",April,2017,April,2017,carlotam,Austria,Europe,male,1,1,female,90
479237357_2,Christ_POS_2302_2,There is also a train but we did not try that .,April,2017,April,2017,carlotam,Austria,Europe,male,2,0,female,90
479237357_3,Christ_POS_2302_3,I saw other people hiking and cycling there but it looked like hard work !,April,2017,April,2017,carlotam,Austria,Europe,male,1,1,female,90
475936441_1,Christ_POS_2326_1,"it is not high season , it will not be that busy , said our hotel .",April,2017,April,2017,so_voyage49,Germany,Europe,male,1,1,female,69
475936441_2,Christ_POS_2326_2,"So we did not bother to book the train online in advance ( you need to be sure of the weather , set up an account , etc ) and thought by showing up before 8 am it would be ok to avoid crowds .",April,2017,April,2017,so_voyage49,Germany,Europe,male,1,1,female,69
475936441_3,Christ_POS_2326_3,"Starting the journey by metro / bus from Ipanema before 7 , we did make it to Come Velho by 7:45 .",April,2017,April,2017,so_voyage49,Germany,Europe,male,1,1,female,69
475936441_4,Christ_POS_2326_4,"There were already a few people there , very short line .",April,2017,April,2017,so_voyage49,Germany,Europe,male,1,1,female,69
475936441_5,Christ_POS_2326_5,"If you only have cash , you must get to a Caixa office nearby to get a voucher , then come back to exchange it .",April,2017,April,2017,so_voyage49,Germany,Europe,male,1,1,female,69
475936441_6,Christ_POS_2326_6,"So along with a few others , we waited for that office to open .",April,2017,April,2017,so_voyage49,Germany,Europe,male,3,1,female,69
475936441_7,Christ_POS_2326_7,"When it did , second surprise - not just the first couple of trains were full , but the first ten !",April,2017,April,2017,so_voyage49,Germany,Europe,male,1,1,female,69
475936441_8,Christ_POS_2326_8,"The waiting area for the train is very good , enough seats , some air con , clean bathrooms and even free WiFi !",April,2017,April,2017,so_voyage49,Germany,Europe,male,3,1,female,69
475936441_9,Christ_POS_2326_9,So it was not too bad but next time I would book ahead .,April,2017,April,2017,so_voyage49,Germany,Europe,male,1,1,female,69
475936441_10,Christ_POS_2326_10,"Trains are very punctual , you only need to get there 10-20 min early ( depending on whether you care where to sit ) .",April,2017,April,2017,so_voyage49,Germany,Europe,male,1,1,female,69
475936441_11,Christ_POS_2326_11,"On the way back , there was a huge line ( in the sun ) for the minibuses , the line for the train down was more reasonable and shaded .",April,2017,April,2017,so_voyage49,Germany,Europe,male,1,1,female,69
473542929_1,Christ_POS_2363_1,We were lucky to have the clouds part as we travelled up the mountain in a cable car before continuing by stairs the last way ( there are escalators ) .,April,2017,April,2017,niks2512,Australia,Oceania,female,1,1,male,6
473542929_2,Christ_POS_2363_2,You approach from behind the base and walk around to view from the front .,April,2017,April,2017,niks2512,Australia,Oceania,female,2,0,male,6
473542929_3,Christ_POS_2363_3,Even early in the morning it can be crowded so getting a photo without others in it is difficult .,April,2017,April,2017,niks2512,Australia,Oceania,female,1,1,male,6
471454363_1,Christ_POS_2402_1,"He is very knowledgeable , personable and accommodating to every need .",March,2017,March,2017,Sumalee_Peg,Germany,Europe,male,3,1,female,8
471454363_2,Christ_POS_2402_2,"We have seen Corcovado , Christ Redeemer , Sugar Loaf , Selaron's step and Rio de Janeiro City .",March,2017,March,2017,Sumalee_Peg,Germany,Europe,male,1,1,female,8
471454363_3,Christ_POS_2402_3,He showed us more other things about Rio de Janeiro we should have missed otherwise .,March,2017,March,2017,Sumalee_Peg,Germany,Europe,male,1,1,female,8
470444346_1,Christ_POS_2428_1,This statue is the symbol of Rio de Janiero and one of the wonders of the modern world .,February,2017,March,2017,FunOnly,Canada,North America,female,3,1,female,733
470444346_2,Christ_POS_2428_2,The best way to get there is on the cog railway .,February,2017,March,2017,FunOnly,Canada,North America,female,3,1,female,733
470444346_3,Christ_POS_2428_3,Tickets can be purchased over a month in advance from the website - tremdo corcovado .,February,2017,March,2017,FunOnly,Canada,North America,female,1,1,female,733
470444346_4,Christ_POS_2428_4,A specific boarding time is purchased so it is wise to arrive at least 15 minutes in advance of the time listed .,February,2017,March,2017,FunOnly,Canada,North America,female,3,1,female,733
470444346_5,Christ_POS_2428_5,Click the flag at the top left and select the stars and stripes for English .,February,2017,March,2017,FunOnly,Canada,North America,female,2,0,female,733
470444346_6,Christ_POS_2428_6,Best views are on the right ascending and the left descending .,February,2017,March,2017,FunOnly,Canada,North America,female,3,1,female,733
470444346_7,Christ_POS_2428_7,"Note that the gate for boarding on the descent is midplatform , this is the place to sit for a good seat once the train arrives .",February,2017,March,2017,FunOnly,Canada,North America,female,1,1,female,733
470444346_8,Christ_POS_2428_8,Allow about 30 minutes at the top to relish the great view and the statue itself .,February,2017,March,2017,FunOnly,Canada,North America,female,3,1,female,733
470444346_9,Christ_POS_2428_9,Best times to visit are first thing in the morning before the haze covers the city or at sunset for a view with the warm tones and city lights .,February,2017,March,2017,FunOnly,Canada,North America,female,3,1,female,733
467821355_1,Christ_POS_2472_1,"This place is a must , regardless of your religious persuasion .",March,2017,March,2017,RodG1506,United Kingdom,Europe,male,3,1,male,96
467821355_2,Christ_POS_2472_2,it is reached by a cog driven railway up some very steep inclines and ravines through tropical rain forest .,March,2017,March,2017,RodG1506,United Kingdom,Europe,male,1,1,male,96
467821355_3,Christ_POS_2472_3,"Once there , we were in the clouds , it is so high up .",March,2017,March,2017,RodG1506,United Kingdom,Europe,male,3,1,male,96
467821355_4,Christ_POS_2472_4,Then for a few seconds the sun shone on the statue of Christ !,March,2017,March,2017,RodG1506,United Kingdom,Europe,male,2,0,male,96
467821355_5,Christ_POS_2472_5,People roared in cheer and took pictures of the incredible structure .,March,2017,March,2017,RodG1506,United Kingdom,Europe,male,3,1,male,96
467821355_6,Christ_POS_2472_6,The views of Rio from the top must be stunning in clear weather !,March,2017,March,2017,RodG1506,United Kingdom,Europe,male,3,1,male,96
466877846_1,Christ_POS_2488_1,"If you go to Rio de Janeiro , you can not miss this .",November,2016,March,2017,craig1086,Georgia,Asia,female,1,1,male,77
466877846_2,Christ_POS_2488_2,"However , the day we went , it was foggy so I could not see anything but fog .",November,2016,March,2017,craig1086,Georgia,Asia,female,2,0,male,77
466877846_3,Christ_POS_2488_3,"Was disappointed , but I made it back right before I left the city , and it is AMAZING .",November,2016,March,2017,craig1086,Georgia,Asia,female,3,1,male,77
466877846_4,Christ_POS_2488_4,"Take Uber out there , as it is dirt cheap in Brazil .",November,2016,March,2017,craig1086,Georgia,Asia,female,1,1,male,77
466877846_5,Christ_POS_2488_5,"Then take the van halfway up , and then the shuttle to the elevator that takes you to the base .",November,2016,March,2017,craig1086,Georgia,Asia,female,2,0,male,77
466877846_6,Christ_POS_2488_6,"It does get crowded early in the day , so a morning visit is best .",November,2016,March,2017,craig1086,Georgia,Asia,female,3,1,male,77
466159664_1,Christ_POS_2506_1,We were able to buy skip the line tickets for R $ 60 ( regular price is 41 ) from guys walking up to our taxi cab .,February,2017,March,2017,JulesReviews,Canada,North America,female,1,1,male,86
466159664_2,Christ_POS_2506_2,Apparently these guys are always there and the price is usually R $ 50 .,February,2017,March,2017,JulesReviews,Canada,North America,female,1,1,male,86
466159664_3,Christ_POS_2506_3,One of the guys escorted us from the cab to the gift shop where the line-up starts for the shuttle .,February,2017,March,2017,JulesReviews,Canada,North America,female,1,1,male,86
466159664_4,Christ_POS_2506_4,We pre-arranged pick-up with our taxi driver for 1.5 hrs after he dropped us off .,February,2017,March,2017,JulesReviews,Canada,North America,female,1,1,male,86
466159664_5,Christ_POS_2506_5,More time is required if you want to peruse around the gift shop ( which in my opinion looked like the best gift shop in Rio and grab a bite to eat .,February,2017,March,2017,JulesReviews,Canada,North America,female,1,1,male,86
466159664_6,Christ_POS_2506_6,"There is a restaurant up top that provides a stunning view , also probably the best in the city .",February,2017,March,2017,JulesReviews,Canada,North America,female,4,2,male,86
466159664_7,Christ_POS_2506_7,Under no circumstance would I recommend walking up the hill to the statue .,February,2017,March,2017,JulesReviews,Canada,North America,female,1,1,male,86
466159664_8,Christ_POS_2506_8,"I heard you still have to buy an entrance ticket whether or not you use the shuttle , so I can not understand why some people walked up that hill .",February,2017,March,2017,JulesReviews,Canada,North America,female,0,2,male,86
464059235_1,Christ_POS_2539_1,You go here for the train ride up the mountain and then the views from the top .,February,2017,March,2017,Elliott S,Canada,North America,male,2,0,male,58
464059235_2,Christ_POS_2539_2,We did this as part of our full day tour with a private guide as he facilitated the ticket buying and keeping our group together as a unit .,February,2017,March,2017,Elliott S,Canada,North America,male,3,1,male,58
464059235_3,Christ_POS_2539_3,Train tickets to the top are about 25 $ no senior rate .,February,2017,March,2017,Elliott S,Canada,North America,male,1,1,male,58
464059235_4,Christ_POS_2539_4,Whatever crowds exist at the bottom are nothing compared to the difficulty of moving around up on top .,February,2017,March,2017,Elliott S,Canada,North America,male,1,1,male,58
464059235_5,Christ_POS_2539_5,But the 360 views give an amazing perspective of Rio and the surroundings .,February,2017,March,2017,Elliott S,Canada,North America,male,3,1,male,58
464059235_6,Christ_POS_2539_6,"And , there is NO NEED to book chopper rides from Sugarloaf mountain to enhance your experience .",February,2017,March,2017,Elliott S,Canada,North America,male,1,1,male,58
459666254_1,Christ_POS_2624_1,Good place to think about life and trust all areas of your life to Lord Jesus Christ .,January,2017,February,2017,Raimonds R,Latvia,Europe,female,3,1,male,61
454881335_1,Christ_POS_2711_1,"the train is a great experience alone and there are splendid views from the top - go really early to miss the crowds , although the views on a clear night must be amazing , there are cafes & souvenir shops at the top - not much climbing as there are escalators to get you from the train to the statue or if you are really fit you can run up the 200 steps - make sure you put it on the itinerary , .",January,2017,January,2017,gypsy039,Australia,Oceania,male,2,0,female,91
454513576_1,Christ_POS_2718_1,it was great looking at this and our guide claudio was brilliant getting us in the best place for the pictures the statue is amazing .,June,2016,January,2017,val7037517,United Kingdom,Europe,male,4,2,female,7
454456719_1,Christ_POS_2719_1,"Amazing views and a clear and scorching day for us , do check the weather forecast .",January,2017,January,2017,Sarah L,United Kingdom,Europe,male,3,1,female,6
454456719_2,Christ_POS_2719_2,"Although there is a huge crowd , everyone is patient to wait their turn and transfers are fast and well organised from the visitors centre .",January,2017,January,2017,Sarah L,United Kingdom,Europe,male,1,1,female,6
454456719_3,Christ_POS_2719_3,"Walk up the stairs for the anticipation , if you can !",January,2017,January,2017,Sarah L,United Kingdom,Europe,male,3,1,female,6
454456719_4,Christ_POS_2719_4,"Tip - Go with a private guide , this will cut the queue .",January,2017,January,2017,Sarah L,United Kingdom,Europe,male,3,1,female,6
453553170_1,Christ_POS_2736_1,Be careful when you go because if there is fog you will not ever see the statue standing right below it .,January,2017,January,2017,Kirsty H,Australia,Oceania,male,1,1,female,7
453553170_2,Christ_POS_2736_2,Check the web cams online to see the visibility before you go .,January,2017,January,2017,Kirsty H,Australia,Oceania,male,1,1,female,7
450584898_1,Christ_POS_2778_1,Only issue is that it is so crowded around the statue with tonnes of people trying to take photos .,November,2016,January,2017,Natalia T,Singapore,Asia,male,1,1,female,71
450576915_1,Christ_POS_2779_1,"Sometimes such sites are a bit anti-climactic , but in this case not so .",January,2017,January,2017,JackM291,Spain,Europe,male,1,1,male,74
