341117591_1,Christ_POS_4884_1,If You have a good luck You get a perfect view of all city in sunny day .,January,2016,January,2016,Baruch Z,Israel,Asia,male,3,1,male,64
340547012_1,Christ_POS_4904_1,You have not really been in Rio if you have not been to Cristo Redentor .,April,2015,January,2016,Edwin P,Sweden,Europe,male,1,1,male,8
340547012_2,Christ_POS_4904_2,"Make sure you go when the weather is good , otherwise you will not be able to see anything .",April,2015,January,2016,Edwin P,Sweden,Europe,male,2,0,male,8
340547012_3,Christ_POS_4904_3,"I was unlucky and went there on a cloudy day , could barely see the Cristo Redentor .",April,2015,January,2016,Edwin P,Sweden,Europe,male,1,1,male,8
340547012_4,Christ_POS_4904_4,But the clouds dissapeared every once in a while so you could see it .,April,2015,January,2016,Edwin P,Sweden,Europe,male,3,1,male,8
339928782_1,Christ_POS_4923_1,We took a taxi from hotel to the area we purchase tickets .,December,2015,January,2016,Maria D,Canada,North America,female,1,1,female,9
339928782_2,Christ_POS_4923_2,We waited three hours to board on bus which brought us there .,December,2015,January,2016,Maria D,Canada,North America,female,1,1,female,9
339928782_3,Christ_POS_4923_3,"The road was full of curves , the driver gave us a ride and a half .",December,2015,January,2016,Maria D,Canada,North America,female,1,1,female,9
339928782_4,Christ_POS_4923_4,You can also take nice pictures of Rio from up there .,December,2015,January,2016,Maria D,Canada,North America,female,3,1,female,9
339226892_1,Christ_POS_4949_1,"Cristo Redentor is a must see in Rio de Janeiro , although it is completely pointless with rainy , cloudy weather .",April,2015,January,2016,KajaC_11,Canada,North America,male,1,1,female,83
339226892_2,Christ_POS_4949_2,Sunny day will provide you with excellent views and unforgettable memories .,April,2015,January,2016,KajaC_11,Canada,North America,male,4,2,female,83
339226892_3,Christ_POS_4949_3,"In peak season lines tend to be endless , but train crew is surprisingly well organized and pretty fast , so you will not be waiting too long .",April,2015,January,2016,KajaC_11,Canada,North America,male,3,1,female,83
339226892_4,Christ_POS_4949_4,"It is a fun ride , usually with live , local music on board .",April,2015,January,2016,KajaC_11,Canada,North America,male,4,2,female,83
339226892_5,Christ_POS_4949_5,"there is cafeteria and several souvenir stores on the top , as well as bunch of super playful monkeys .",April,2015,January,2016,KajaC_11,Canada,North America,male,1,1,female,83
339226892_6,Christ_POS_4949_6,"If you looking for a great company , reliable service and tons of useful information I could recommend my good friend and awesome tour-guide to show you around the City of God - Daniel Pedroza .",April,2015,January,2016,KajaC_11,Canada,North America,male,3,1,female,83
338157402_1,Christ_POS_4986_1,"Long waiting lines to get up there , but the view is worth the wait .",January,2016,January,2016,MikeD457,Netherlands,Europe,male,3,1,female,8
338157402_2,Christ_POS_4986_2,They could really fine tune how everything is being operated there .,January,2016,January,2016,MikeD457,Netherlands,Europe,male,3,1,female,8
336900229_1,Christ_POS_5034_1,"I had a 3 day window to visit the Corcovado , the first two days where cloudy and on my final attempt we had a lovely day .",December,2015,January,2016,james_taylor5,United Kingdom,Europe,female,1,1,male,7
336900229_2,Christ_POS_5034_2,After reading reviews on here i decided to go quite late on in the day .,December,2015,January,2016,james_taylor5,United Kingdom,Europe,female,1,1,male,7
336900229_3,Christ_POS_5034_3,We got an UBER as far up the mountain as we could which was unbelievably cheap and then got the minibus the rest of the way .,December,2015,January,2016,james_taylor5,United Kingdom,Europe,female,1,1,male,7
336900229_4,Christ_POS_5034_4,We arrived at the top at 6.00 pm and although it was still busy we had plenty of room to walk about and take photos from all angles .,December,2015,January,2016,james_taylor5,United Kingdom,Europe,female,1,1,male,7
336900229_5,Christ_POS_5034_5,We went to the cafe and managed to get a seat with a nice view straight away .,December,2015,January,2016,james_taylor5,United Kingdom,Europe,female,3,1,male,7
336840367_1,Christ_POS_5037_1,"Corcovado , located at Tijuca Forest is a must go in Rio .",December,2015,January,2016,Miguel2770,Portugal,Europe,male,1,1,male,825
336840367_2,Christ_POS_5037_2,The trip till there from Rio over Santa teresa and Floresta da Tijuca .,December,2015,January,2016,Miguel2770,Portugal,Europe,male,2,0,male,825
336840367_3,Christ_POS_5037_3,Being there there is a fee of 10 USD to go to the statue .,December,2015,January,2016,Miguel2770,Portugal,Europe,male,1,1,male,825
336840367_4,Christ_POS_5037_4,"The views are incredible , there is a small chappel to Nossa Senhora da Aparecida , and a lot to see .",December,2015,January,2016,Miguel2770,Portugal,Europe,male,3,1,male,825
336840367_5,Christ_POS_5037_5,Suggestion - try to go there in the small train from Rio .,December,2015,January,2016,Miguel2770,Portugal,Europe,male,2,0,male,825
336840367_6,Christ_POS_5037_6,Need to book and it is always crowded but is the best .,December,2015,January,2016,Miguel2770,Portugal,Europe,male,3,1,male,825
336680684_1,Christ_POS_5040_1,"we would booked an early bird tour to beat the crowds , which was great but the low cloud meant visibility was poor .",August,2015,January,2016,NickH870,United Kingdom,Europe,male,1,1,male,9
336680684_2,Christ_POS_5040_2,It did clear sufficiently to see the statue but we missed out on the views of the City .,August,2015,January,2016,NickH870,United Kingdom,Europe,male,1,1,male,9
336680684_3,Christ_POS_5040_3,"Luck of the draw , you can not control the weather !",August,2015,January,2016,NickH870,United Kingdom,Europe,male,1,1,male,9
336259145_1,Christ_POS_5055_1,It is an exciting and fun experience to make your way to the foot of the famous statue and the views are excellent .,December,2015,December,2015,Matt J,Canada,North America,female,4,2,male,7
336259145_2,Christ_POS_5055_2,"does not matter the type of weather , it will be thoroughly enjoyed by all family members young and old .",December,2015,December,2015,Matt J,Canada,North America,female,3,1,male,7
336171726_1,Christ_POS_5058_1,Going to an attraction like this should never be about the money .,January,2015,December,2015,RobertM2019J,Kenya,Africa,female,2,0,male,68
336171726_2,Christ_POS_5058_2,The cost of the ticket does not matter when the Corcovado is looming above you .,January,2015,December,2015,RobertM2019J,Kenya,Africa,female,1,1,male,68
336171726_3,Christ_POS_5058_3,At night it is lit up and during the day the view from up there is incredible .,January,2015,December,2015,RobertM2019J,Kenya,Africa,female,3,1,male,68
335490973_1,Christ_POS_5084_1,Obviously this is a must see visit and it is a good day out .,December,2015,December,2015,LauraJevons,United Kingdom,Europe,male,3,1,female,59
335490973_2,Christ_POS_5084_2,Very touristy but surprisingly it was not as busy as you would expect .,December,2015,December,2015,LauraJevons,United Kingdom,Europe,male,1,1,female,59
335490973_3,Christ_POS_5084_3,We turned up mid morning and did not have to queue which was good .,December,2015,December,2015,LauraJevons,United Kingdom,Europe,male,1,1,female,59
335490973_4,Christ_POS_5084_4,We got the train to the top which was fun and is included in the ticket price ( keep hold of your ticket fir the ride back ) .,December,2015,December,2015,LauraJevons,United Kingdom,Europe,male,3,1,female,59
335490973_5,Christ_POS_5084_5,"The trains are every 30 minutes , sit on the right on the way up for the best view of Rio .",December,2015,December,2015,LauraJevons,United Kingdom,Europe,male,1,1,female,59
335490973_6,Christ_POS_5084_6,Good view but the images you have of Rio in your mind probably include Cristo and you obviously can not see that in the view when you are stood right next to it .,December,2015,December,2015,LauraJevons,United Kingdom,Europe,male,1,1,female,59
335490973_7,Christ_POS_5084_7,You can however see sugarloaf and the rest of the city .,December,2015,December,2015,LauraJevons,United Kingdom,Europe,male,3,1,female,59
335490973_8,Christ_POS_5084_8,there is a restaurant and a bar / snack bar at the top where you can sit outside which are nice to spend some time .,December,2015,December,2015,LauraJevons,United Kingdom,Europe,male,3,1,female,59
335047172_1,Christ_POS_5103_1,"I go to Rio often , and every time I take the time to visit the Corcovado and the little church on the top .",July,2015,December,2015,florian610,United Kingdom,Europe,male,1,1,male,92
335047172_2,Christ_POS_5103_2,do not make the mistake and see this as just another tourist attraction .,July,2015,December,2015,florian610,United Kingdom,Europe,male,1,1,male,92
335047172_3,Christ_POS_5103_3,"Yes , it is packed often , but worth every minute .",July,2015,December,2015,florian610,United Kingdom,Europe,male,3,1,male,92
335047172_4,Christ_POS_5103_4,I find the statue gives a special energy that radiates throughout Rio .,July,2015,December,2015,florian610,United Kingdom,Europe,male,3,1,male,92
335047172_5,Christ_POS_5103_5,"From the bottom , you get great views on the Cristo from Lagoa and if you sport a 300 zoom , get a cab to Praia Botafogo to take pictures from the front .",July,2015,December,2015,florian610,United Kingdom,Europe,male,1,1,male,92
333655040_1,Christ_POS_5147_1,Almost everywhere in Rio the skyline is dominated by this iconic figure but the journey to the foot of it is an experience in itself .,December,2015,December,2015,ricky39,United Kingdom,Europe,female,1,1,male,69
333655040_2,Christ_POS_5147_2,The train takes you to the foot of the statue and climbs through the thick rain forest terrain .,December,2015,December,2015,ricky39,United Kingdom,Europe,female,1,1,male,69
333165427_1,Christ_POS_5157_1,The 68 reais per person you pay to take the train up to the Corcovado hills are really worth it !,December,2015,December,2015,FedericoPaesano,Italy,Europe,female,4,2,male,62
333165427_2,Christ_POS_5157_2,"Down from the train ( 15 minutes ride a few steps and you are at the base of the Christ , with a stunning view of the whole bay of Rio de Janeiro .",December,2015,December,2015,FedericoPaesano,Italy,Europe,female,3,1,male,62
333165427_3,Christ_POS_5157_3,"There is a a bar-restaurant at the top , if you want to chill-out and enjoy the view .",December,2015,December,2015,FedericoPaesano,Italy,Europe,female,3,1,male,62
333165427_4,Christ_POS_5157_4,"Photo-wise , the statue gets the light in the front in the morning .",December,2015,December,2015,FedericoPaesano,Italy,Europe,female,3,1,male,62
333165427_5,Christ_POS_5157_5,"In the afternoon , the light is in the back and it is difficult to get good pictures !",December,2015,December,2015,FedericoPaesano,Italy,Europe,female,1,1,male,62
332992964_1,Christ_POS_5161_1,"A small train transported us through the National Park to the summit and there stood the magnificent Statue of Christ the redeemer , I will never forget the experience and magnificent views of Rio .",November,2015,December,2015,Fran C,United Kingdom,Europe,female,3,1,female,8
332992964_2,Christ_POS_5161_2,I can not believe I have been there twice in five years .,November,2015,December,2015,Fran C,United Kingdom,Europe,female,1,1,female,8
330026512_1,Christ_POS_5252_1,This was in my bucket list and it did not disappoint me .,November,2015,November,2015,EUGENIE A,Australia,Oceania,male,1,1,female,8
330026512_2,Christ_POS_5252_2,Crowds can be hectic and I was also lucky enough also to see a sunset view .,November,2015,November,2015,EUGENIE A,Australia,Oceania,male,3,1,female,8
329330558_1,Christ_POS_5272_1,"Make sure the weather is clear if you have several days to choose from , when we went up it was partly cloudy and the statue was visible but unfortunately hardly nothing of the city below .",November,2015,November,2015,Johan B,Sweden,Europe,male,1,1,male,8
328098366_1,Christ_POS_5309_1,"If you are planning to go , choose a nice clear day and go early .",November,2015,November,2015,Megan J,United Arab Emirates,Asia,female,3,1,female,9
328098366_2,Christ_POS_5309_2,We went around 11am and spend 1 hour in line waiting to go up and another 1 hours waiting to go down .,November,2015,November,2015,Megan J,United Arab Emirates,Asia,female,1,1,female,9
328098366_3,Christ_POS_5309_3,80 % of the area where you wait is in the sun so wear sunblock and take a hat or umbrella .,November,2015,November,2015,Megan J,United Arab Emirates,Asia,female,1,1,female,9
328098366_4,Christ_POS_5309_4,The views from the top are spectacular and despite the crowds if you are a bit patient you will great some great pics !,November,2015,November,2015,Megan J,United Arab Emirates,Asia,female,4,2,female,9
327239766_1,Christ_POS_5328_1,"A real must do - even of the weather is bad , as it was on the first day we went up there .",October,2015,November,2015,Robert H,United Kingdom,Europe,male,1,1,male,65
327239766_2,Christ_POS_5328_2,"Low cloud , rain but even so it was highly atmospheric .",October,2015,November,2015,Robert H,United Kingdom,Europe,male,1,1,male,65
327239766_3,Christ_POS_5328_3,Went again two days later in brilliant sunshine and it is simply stunning .,October,2015,November,2015,Robert H,United Kingdom,Europe,male,4,2,male,65
327239766_4,Christ_POS_5328_4,Second visit we went on the train and this was much more enjoyable than the car .,October,2015,November,2015,Robert H,United Kingdom,Europe,male,4,2,male,65
327239766_5,Christ_POS_5328_5,"Easy to get to , safe and not packed - however , be prepared for a long wait ( we had 2 hours frombuying our tickets - may be worth getting there early or late ) .",October,2015,November,2015,Robert H,United Kingdom,Europe,male,1,1,male,65
325293025_1,Christ_POS_5381_1,Exactly what you would expect from this iconic monument - busy and overpriced but awesome views and definitely worth a visit .,July,2015,November,2015,CharliAv,Egypt,Africa,male,2,0,female,7
325184557_1,Christ_POS_5383_1,"On a sunny day , the view is amazing and The Christ is BIG !",September,2015,November,2015,Peter A,Sweden,Europe,female,3,1,male,6
323955558_1,Christ_POS_5403_1,"A great must see attraction in Rio , however very crowded and virtually impossible to get a good pic without tens of people in your shot or selfie !",October,2015,November,2015,Hayley K,United Kingdom,Europe,male,2,0,female,8
322485462_1,Christ_POS_5443_1,"That said , it is quite the sight and one worth seeing .",October,2015,October,2015,AllieKatz2009,United Kingdom,Europe,female,3,1,female,8
322279731_1,Christ_POS_5451_1,We took a little bus from the centre and it drove us right to the top .,August,2015,October,2015,RobbertQ,Netherlands,Europe,male,3,1,male,7
322279731_2,Christ_POS_5451_2,It was partly cloudy so every now and then the statue would disappear .,August,2015,October,2015,RobbertQ,Netherlands,Europe,male,2,0,male,7
322279731_3,Christ_POS_5451_3,"Good thing there was plenty sunshine between the clouds , a must otherwise the trip up there is useless .",August,2015,October,2015,RobbertQ,Netherlands,Europe,male,1,1,male,7
322279731_4,Christ_POS_5451_4,"The statue is just amazing , it is nice to see it close up !",August,2015,October,2015,RobbertQ,Netherlands,Europe,male,4,2,male,7
322279731_5,Christ_POS_5451_5,It is a must see when in Rio no matter what .,August,2015,October,2015,RobbertQ,Netherlands,Europe,male,2,0,male,7
322279731_6,Christ_POS_5451_6,"Great views of the city and yes , there is Wifi too , .",August,2015,October,2015,RobbertQ,Netherlands,Europe,male,3,1,male,7
322179723_1,Christ_POS_5452_1,Ride up by the great funicular railway then a lift and a couple of escalators .,October,2015,October,2015,Chris B,United Kingdom,Europe,male,3,1,male,78
322179723_2,Christ_POS_5452_2,Beware the weather is liable to rapid change and the train only departs every 30 minutes .,October,2015,October,2015,Chris B,United Kingdom,Europe,male,2,0,male,78
322123004_1,Christ_POS_5453_1,We took the bus up to reach the top and wow what a ride !,October,2015,October,2015,martin_hoyle,United Kingdom,Europe,male,4,2,male,69
322123004_2,Christ_POS_5453_2,The driver took the twisting bends at such speed narrowly missing oncoming vehicles to perfection - clearly a frustrated racing driver .,October,2015,October,2015,martin_hoyle,United Kingdom,Europe,male,1,1,male,69
322123004_3,Christ_POS_5453_3,"After reaching the top , Christ was in the clouds and fortunately there were not too many people around .",October,2015,October,2015,martin_hoyle,United Kingdom,Europe,male,1,1,male,69
322123004_4,Christ_POS_5453_4,After a 15 minute wait the clouds parted to reveal Christ and the view of Rio .,October,2015,October,2015,martin_hoyle,United Kingdom,Europe,male,1,1,male,69
320938999_1,Christ_POS_5466_1,"Although services in Rio are usually pricey and a bit unfriendly , getting to the top of Corcovado mountain to enjoy this world-famous landmark compensates it all .",November,2014,October,2015,Marcos_Bastos,Canada,North America,male,1,1,male,8
320739572_1,Christ_POS_5470_1,The views and history of this place are amazing - a must see on a sunny day .,October,2015,October,2015,Joan N,Norway,Europe,female,4,2,female,7
320739572_2,Christ_POS_5470_2,"However , be aware of the crowds and long lines that increase during the day .",October,2015,October,2015,Joan N,Norway,Europe,female,2,0,female,7
320709800_1,Christ_POS_5471_1,"This is a world landmark you can not come to Rio de Janeiro and not see it , prepare your camera to take lots of pictures of the amazing views of Rio from here .",October,2015,October,2015,TeresaViajera2019,Mexico,North America,female,3,1,female,87
320709800_2,Christ_POS_5471_2,Dedicated a good hour to be there and take all the beauty that this place offers .,October,2015,October,2015,TeresaViajera2019,Mexico,North America,female,3,1,female,87
320709800_3,Christ_POS_5471_3,there is a small coffee shop with snacks in the lower area of the monument .,October,2015,October,2015,TeresaViajera2019,Mexico,North America,female,1,1,female,87
319532781_1,Christ_POS_5492_1,A must see trip to make to see Christ the Redeemer up close & personal .,June,2015,October,2015,1AnnetteA,Australia,Oceania,female,3,1,female,62
319532781_2,Christ_POS_5492_2,You will not believe how BIG he is until you get to the top & stand on that pinnacle and look up !,June,2015,October,2015,1AnnetteA,Australia,Oceania,female,1,1,female,62
319532781_3,Christ_POS_5492_3,"( along with a hundred or more other people it seems ) Recognisable from so many places surrounding Rio , a visit by cog train is a happy experience & one filled with awe at the building of & the very idea of this statue being built there .",June,2015,October,2015,1AnnetteA,Australia,Oceania,female,1,1,female,62
317594298_1,Christ_POS_5534_1,When visiting Rio De Janeiro you must see the crocovado and take photos there .,October,2015,October,2015,AmrAbdallah,Egypt,Africa,male,3,1,male,83
310842591_1,Christ_POS_5644_1,"The little train to climb the mountain is very nice to observe the environment , the view is wonderful up there , especially for the sunset .",February,2015,September,2015,HubertFrerot,France,Europe,male,3,1,male,6
310842591_2,Christ_POS_5644_2,"The only thing is there is too many tourist anytime of the day , .",February,2015,September,2015,HubertFrerot,France,Europe,male,1,1,male,6
309275890_1,Christ_POS_5670_1,This is one of the places you should not miss if you are in Rio de Janeiro .,August,2015,September,2015,Chris997,Singapore,Asia,male,1,1,male,81
309275890_2,Christ_POS_5670_2,Of course the view on the Corcovado mountain overlooking the city is by itself a sight for your panoramic camera but to be on site looking up the Christ the Redeemer is an overwhelming experience .,August,2015,September,2015,Chris997,Singapore,Asia,male,1,1,male,81
309275890_3,Christ_POS_5670_3,Do not forget to visit the chapel at the rear of the base of the sculpture .,August,2015,September,2015,Chris997,Singapore,Asia,male,1,1,male,81
308498535_1,Christ_POS_5685_1,"The being said , you need to be careful with your personal belongings as pickpocketing is an issue .",September,2015,September,2015,Ronnie92175,United States,North America,male,1,1,male,8
308436478_1,Christ_POS_5686_1,Take the minibus trips from Praa do Lido on Copacobana if you are in that area .,July,2015,September,2015,Daniel S,United Kingdom,Europe,male,2,0,male,7
308436478_2,Christ_POS_5686_2,Price was around R $ 65 for the return trip and entry at the top .,July,2015,September,2015,Daniel S,United Kingdom,Europe,male,3,1,male,7
308436478_3,Christ_POS_5686_3,"The top was very crowded and it is selfie-land to the extreme , but with a bit of patience you can get your own pictures and the views from all sides are spectacular .",July,2015,September,2015,Daniel S,United Kingdom,Europe,male,3,1,male,7
308436478_4,Christ_POS_5686_4,"This assumes you have good visibility of course , which we luckily did .",July,2015,September,2015,Daniel S,United Kingdom,Europe,male,3,1,male,7
308436478_5,Christ_POS_5686_5,"Check the weather forecast , because you pretty much can not see a thing if it is a cloudy / foggy day .",July,2015,September,2015,Daniel S,United Kingdom,Europe,male,1,1,male,7
308048597_1,Christ_POS_5687_1,"The lines were the only unpleasant part of this experience , I gave up on the lift and took a minibus to the summit very safe and wonderful view .",October,2014,September,2015,Giuseppe C,United Kingdom,Europe,male,3,1,male,65
304750786_1,Christ_POS_5746_1,Part of our city tour brought us up Corcovado to see the Statue Christ the Redeemer .,August,2015,August,2015,S1las,United Kingdom,Europe,male,3,1,male,72
304750786_2,Christ_POS_5746_2,We ran up the final steps but a lift is available .,August,2015,August,2015,S1las,United Kingdom,Europe,male,2,0,male,72
304750786_3,Christ_POS_5746_3,"When you get to the top the view if it is a clear day is stunning , beaches , football stadiums , the Sugarloaf .",August,2015,August,2015,S1las,United Kingdom,Europe,male,3,1,male,72
304750786_4,Christ_POS_5746_4,"The statue itself is just amazing I could not stop looking at him , his face is soo calm .",August,2015,August,2015,S1las,United Kingdom,Europe,male,1,1,male,72
302395464_1,Christ_POS_5775_1,Very busy touristic area but I would not miss it for anything .,August,2015,August,2015,JanDreamer,Georgia,Asia,male,1,1,female,9
302395464_2,Christ_POS_5775_2,"The views over Rio are also great , you get 360 degree views .",August,2015,August,2015,JanDreamer,Georgia,Asia,male,3,1,female,9
301995370_1,Christ_POS_5782_1,"Pity there was maintenance to the statue at the moment , scaffolding not appealing .",August,2015,August,2015,Deb A,United Kingdom,Europe,female,1,1,female,75
301882920_1,Christ_POS_5783_1,I checked quite a lot of reviews of Corcovado and because of that I decided to take the first train 08:30 .,August,2015,August,2015,Pekka A,Finland,Europe,female,3,1,male,6
301882920_2,Christ_POS_5783_2,Taxi from Copacabana took twenty minutes and was little bit more than twenty RS .,August,2015,August,2015,Pekka A,Finland,Europe,female,1,1,male,6
301882920_3,Christ_POS_5783_3,"At the time TREM DO CORCOVADO started off , there were maybe fourty visitors onboard .",August,2015,August,2015,Pekka A,Finland,Europe,female,1,1,male,6
301882920_4,Christ_POS_5783_4,"I really recommend to get there early , because when I came back down to the station , the queues where quite long , Up there was amazing !",August,2015,August,2015,Pekka A,Finland,Europe,female,4,2,male,6
301882920_5,Christ_POS_5783_5,I have travelled a lot ( I mean A LOT but this place is must .,August,2015,August,2015,Pekka A,Finland,Europe,female,1,1,male,6
301882920_6,Christ_POS_5783_6,Its goes to TOP 10 in my list all over the world .,August,2015,August,2015,Pekka A,Finland,Europe,female,1,1,male,6
301882920_7,Christ_POS_5783_7,One more thing - They told me when buing my ticket that there is no visibility up there ( SEM VISIBILDADE ) .,August,2015,August,2015,Pekka A,Finland,Europe,female,1,1,male,6
300926510_1,Christ_POS_5804_1,get to the ticket office when it opens at 8am then you will be on the first team .,August,2015,August,2015,Debbie B,United Kingdom,Europe,female,1,1,female,76
300926510_2,Christ_POS_5804_2,"This means only the amount of people on that tram will be up there for at least the first half hour , after that it is heaving and you have difficulty taking photos for the sheer volume of people .",August,2015,August,2015,Debbie B,United Kingdom,Europe,female,1,1,female,76
299390701_1,Christ_POS_5829_1,"Just make sure about the weather , if it is cloudy , forget about it , you will see nothing , .",January,2015,August,2015,Mauro_Lima13,Germany,Europe,male,1,1,male,8
295879248_1,Christ_POS_5881_1,I was not sure I would have made it to the Christ since it was my last day and the information on how to get there are somehow contradictory .,July,2015,August,2015,luni69,Italy,Europe,male,1,1,female,65
295879248_2,Christ_POS_5881_2,"The view itself is worth the visit and the statue , wow , not like anything I have ever seen , and I live in Rome .",July,2015,August,2015,luni69,Italy,Europe,male,4,2,female,65
295879248_3,Christ_POS_5881_3,"It is amazing , peaceful and despite all the tourists walking around you it is like you are alone up there .",July,2015,August,2015,luni69,Italy,Europe,male,3,1,female,65
294833083_1,Christ_POS_5897_1,We just returned from a trip to Brazil and this was one of the fascinating things we saw in Rio .,July,2015,August,2015,Deborah K,Georgia,Asia,female,3,1,female,7
