378168159_29,Taj_POS_10186_29,There is a lone water cooler which may run empty at times .,May,2016,May,2016,India_Expl0rer,India,Asia,male,1,1,female,99
378168159_30,Taj_POS_10186_30,There is a separate way to entrance for normal Indians and Foreigners and VIP's .,May,2016,May,2016,India_Expl0rer,India,Asia,male,2,0,female,99
378168159_31,Taj_POS_10186_31,Normal Indians have to remove shoes at the designated places and go barefoot while the foreigners get the shoe covers with the ticket .,May,2016,May,2016,India_Expl0rer,India,Asia,male,1,1,female,99
378168159_32,Taj_POS_10186_32,"If one goes through the VIP area , then just before the security guard checks the VIP passes , there is a person selling the shoe covers for Rs 10-15 a pair .",May,2016,May,2016,India_Expl0rer,India,Asia,male,1,1,female,99
378168159_33,Taj_POS_10186_33,Buy those and enter from the side from where rest of the Indians are entering .,May,2016,May,2016,India_Expl0rer,India,Asia,male,2,0,female,99
378168159_34,Taj_POS_10186_34,Wear them over the shoes and save your feet from burning .,May,2016,May,2016,India_Expl0rer,India,Asia,male,2,0,female,99
378168159_35,Taj_POS_10186_35,Get a guide if you are visiting for the first time .,May,2016,May,2016,India_Expl0rer,India,Asia,male,1,1,female,99
378168159_36,Taj_POS_10186_36,The guide will try to get a photographer hired but if you remain adamant then you may not get cheated like we were .,May,2016,May,2016,India_Expl0rer,India,Asia,male,1,1,female,99
378168159_37,Taj_POS_10186_37,"They will click multiple photographs , on each and every step you take .",May,2016,May,2016,India_Expl0rer,India,Asia,male,3,1,female,99
378168159_38,Taj_POS_10186_38,Just define the places or views you want to get clicked .,May,2016,May,2016,India_Expl0rer,India,Asia,male,1,1,female,99
378168159_39,Taj_POS_10186_39,Check the photographs before getting them printed as ours did not click clear pics with his own camera even .,May,2016,May,2016,India_Expl0rer,India,Asia,male,1,1,female,99
378168159_40,Taj_POS_10186_40,The guides will take you to multiple shops for showing things but do not buy from there as the guides have commission in the price .,May,2016,May,2016,India_Expl0rer,India,Asia,male,1,1,female,99
378168159_41,Taj_POS_10186_41,Check the price of thing in multiple shops before buying as a fridge magnet was being sold at Rs .,May,2016,May,2016,India_Expl0rer,India,Asia,male,1,1,female,99
378168159_42,Taj_POS_10186_42,If you keep these things in mind the trip would be with all good memories .,May,2016,May,2016,India_Expl0rer,India,Asia,male,3,1,female,99
377247989_1,Taj_POS_10216_1,"Beautiful to see , and we were lucky to visit on w day that was free entry , and included entry to the real tombs which was rare .",May,2016,May,2016,camilla_chellew,United Kingdom,Europe,female,3,1,female,84
377247989_2,Taj_POS_10216_2,"We did not intend to get a guide , but it was really worth it , especially for all the photos he took for us .",May,2016,May,2016,camilla_chellew,United Kingdom,Europe,female,3,1,female,84
375854262_1,Taj_POS_10261_1,We visited the site late afternoon but still the light on the Taj was not quite right to get an excellent picture .,May,2016,May,2016,ioan_wilson,United Kingdom,Europe,male,1,1,male,84
375854262_2,Taj_POS_10261_2,It is difficult to put into words a description of the site .,May,2016,May,2016,ioan_wilson,United Kingdom,Europe,male,1,1,male,84
375854262_3,Taj_POS_10261_3,The wonderful inlaid semi precious stones in the marble was something we had not expected .,May,2016,May,2016,ioan_wilson,United Kingdom,Europe,male,3,1,male,84
374685928_1,Taj_POS_10304_1,"We visited the Taj in late April , 38 + C .",April,2016,May,2016,Alastair M,New Zealand,Oceania,male,1,1,male,9
374685928_2,Taj_POS_10304_2,"Our guide was very good , he would repeat the story of the Taj , he needed to as our eyes were every where , so much to take in .",April,2016,May,2016,Alastair M,New Zealand,Oceania,male,3,1,male,9
374685928_3,Taj_POS_10304_3,"Photos can not be taken inside the actual Taj , there are signs inside to remind you .",April,2016,May,2016,Alastair M,New Zealand,Oceania,male,1,1,male,9
374685928_4,Taj_POS_10304_4,For some reason locals seem able to take as many photos as they like .,April,2016,May,2016,Alastair M,New Zealand,Oceania,male,3,1,male,9
374685928_5,Taj_POS_10304_5,"Wished we could have stayed at Taj longer , it is truly amazing .",April,2016,May,2016,Alastair M,New Zealand,Oceania,male,3,1,male,9
374469700_1,Taj_POS_10313_1,Truly it can stand as one of the 7 wonders of the modern world .,May,2016,May,2016,KaterinaMajor,Cyprus,Asia,male,3,1,female,9
374469700_2,Taj_POS_10313_2,I loved every minute from the moment I stepped in the gates .,May,2016,May,2016,KaterinaMajor,Cyprus,Asia,male,4,2,female,9
374469700_3,Taj_POS_10313_3,I advise planning a weekday visit as in India monuments and temples on weekends are very crowded .,May,2016,May,2016,KaterinaMajor,Cyprus,Asia,male,1,1,female,9
374469700_4,Taj_POS_10313_4,"There is a priority lane for foreigners , which is logical since we pay a ticket which is much more expensive than locals do ( like 100X ) .",May,2016,May,2016,KaterinaMajor,Cyprus,Asia,male,1,1,female,9
373940981_1,Taj_POS_10322_1,"It is more beautiful than any picture can capture , you just have to see it for yourself .",March,2016,May,2016,Vicki S,Australia,Oceania,female,3,1,female,87
373940981_2,Taj_POS_10322_2,A love story that brings a tear to my eye and a sadness in my heart .,March,2016,May,2016,Vicki S,Australia,Oceania,female,3,1,female,87
373940981_3,Taj_POS_10322_3,A structure unlike any other in the world and remarkably maintained .,March,2016,May,2016,Vicki S,Australia,Oceania,female,3,1,female,87
373940981_4,Taj_POS_10322_4,After an hour of so with a tour guide we spent another hour plus just wandering around the TM and its surroundings .,March,2016,May,2016,Vicki S,Australia,Oceania,female,1,1,female,87
373940981_5,Taj_POS_10322_5,"It is one the most , if not the most beautiful structure I have ever seen .",March,2016,May,2016,Vicki S,Australia,Oceania,female,0,2,female,87
373940981_6,Taj_POS_10322_6,I can not imagine anyone coming to India and not taking the Taj Mahal the top of their must see list .,March,2016,May,2016,Vicki S,Australia,Oceania,female,1,1,female,87
373940981_7,Taj_POS_10322_7,We were there at the end of March and it was starting to get a bit warm .,March,2016,May,2016,Vicki S,Australia,Oceania,female,1,1,female,87
373940981_8,Taj_POS_10322_8,We were there early in the morning but there are plenty of trees to provide shade on the grounds but it was quite hot in the sun .,March,2016,May,2016,Vicki S,Australia,Oceania,female,1,1,female,87
368332817_1,Taj_POS_10448_1,"it is hard to believe how beautiful and peaceful this extraordinary monument is , it was the last place we visited in a month of incredible India , this surpassed my high expectations .",April,2016,April,2016,NigelBacon,Australia,Oceania,male,3,1,male,78
368332817_2,Taj_POS_10448_2,"We visited at 1500 hrs , the crowds were less and we never felt rushed or overwhelmed .",April,2016,April,2016,NigelBacon,Australia,Oceania,male,1,1,male,78
367356687_1,Taj_POS_10473_1,What can you say about the Taj Mahal that has not already been said ?,April,2016,April,2016,Muriel M,Canada,North America,female,2,0,female,80
367356687_2,Taj_POS_10473_2,"Even if you have read about it , walking through the East Gate and seeing the Taj gleaming in the garden takes your breath away .",April,2016,April,2016,Muriel M,Canada,North America,female,2,0,female,80
367356687_3,Taj_POS_10473_3,"We were there at dawn , watching the lambent light strengthen so the colours of the marble and pietra dura become more intense .",April,2016,April,2016,Muriel M,Canada,North America,female,1,1,female,80
367356687_4,Taj_POS_10473_4,"The proportions , the prayer around the main door , the balance of the minarets , the detail of the sculptured marble flowers or the marble screens , carved from a single piece of stone , I am babbling , but that is what this site reduces me to .",April,2016,April,2016,Muriel M,Canada,North America,female,1,1,female,80
367356687_5,Taj_POS_10473_5,"One practical piece of advice - if you go at dawn , take mosquito repellant .",April,2016,April,2016,Muriel M,Canada,North America,female,3,1,female,80
366856862_1,Taj_POS_10493_1,"I did wonder whether I would be disappointed , given my high expectations .",April,2016,April,2016,Richard W,United Kingdom,Europe,male,1,1,male,82
366856862_2,Taj_POS_10493_2,"A wonderful building , in beautiful gardens , with plenty to see .",April,2016,April,2016,Richard W,United Kingdom,Europe,male,4,2,male,82
366856862_3,Taj_POS_10493_3,"Visiting inside the tomb was rather like being in a market place , with jostling crowds , noise and guards .",April,2016,April,2016,Richard W,United Kingdom,Europe,male,1,1,male,82
366856862_4,Taj_POS_10493_4,"do not miss the Mosque to the side of the Taj itself , and there is a small museum .",April,2016,April,2016,Richard W,United Kingdom,Europe,male,1,1,male,82
365921331_1,Taj_POS_10530_1,"Most of them , but not all , In ancient history there were wars between countries due to Female ( Girl ) for Love or Beauty or Attraction or Sex .",September,2015,April,2016,Siva_Bandaru,India,Asia,male,1,1,male,8
365921331_2,Taj_POS_10530_2,"If you have seen TajMahal , By now you might have understood why those wars were happened .",September,2015,April,2016,Siva_Bandaru,India,Asia,male,1,1,male,8
365670849_1,Taj_POS_10544_1,"40 a piece , but still , getting a free ride feels good ) !",April,2016,April,2016,591varun,India,Asia,male,3,1,male,9
365670849_2,Taj_POS_10544_2,"The guide - Mr. Amit Kumar , was very patient and knowledgeable and we spent a pleasant 2 hours with him .",April,2016,April,2016,591varun,India,Asia,male,3,1,male,9
365670849_3,Taj_POS_10544_3,It became quite crowded and hot by the time we finished .,April,2016,April,2016,591varun,India,Asia,male,1,1,male,9
363820075_1,Taj_POS_10610_1,I especially liked when we got to see the fire stones !,January,2016,April,2016,VildaHederlig,Sweden,Europe,male,3,1,female,9
363298215_1,Taj_POS_10643_1,"Words can not describe it , a wonderful place not to be missed .",April,2016,April,2016,Frank E,United Kingdom,Europe,male,1,1,male,9
363298215_2,Taj_POS_10643_2,We were advised to visit at sunrise the early wake up was certainly worth it .,April,2016,April,2016,Frank E,United Kingdom,Europe,male,1,1,male,9
362995783_1,Taj_POS_10652_1,"It was clean and well maintained , which was a welcome change from the streets of Agra .",April,2016,April,2016,Kristen M,United Arab Emirates,Asia,female,3,1,female,8
362995783_2,Taj_POS_10652_2,This was a striking monument from a husband to his wife .,April,2016,April,2016,Kristen M,United Arab Emirates,Asia,female,3,1,female,8
362995783_3,Taj_POS_10652_3,"Though they were cleaning 3 out of the 4 pillars , it was still lovely to see .",April,2016,April,2016,Kristen M,United Arab Emirates,Asia,female,3,1,female,8
362686971_1,Taj_POS_10663_1,"The only one thing which was not so good , was the fee .",January,2016,April,2016,Kristina_Bohmer,Slovakia,Europe,male,1,1,female,9
362686971_2,Taj_POS_10663_2,As usual in India tourists have to pay much more than Indians just because they are tourists .,January,2016,April,2016,Kristina_Bohmer,Slovakia,Europe,male,1,1,female,9
362686971_3,Taj_POS_10663_3,"When you buy a ticket , there are many guys who want to be your guide and the always tell you it is for free and you can give only some tip .",January,2016,April,2016,Kristina_Bohmer,Slovakia,Europe,male,3,1,female,9
362686971_4,Taj_POS_10663_4,"The building is really majestic and beautiful , you have to see it when visiting Agra .",January,2016,April,2016,Kristina_Bohmer,Slovakia,Europe,male,3,1,female,9
362686971_5,Taj_POS_10663_5,"It is very clean over there , you just can not believe it is in India !",January,2016,April,2016,Kristina_Bohmer,Slovakia,Europe,male,3,1,female,9
362686971_6,Taj_POS_10663_6,"That is why you can not take any food or drink , for example gums , because there is a risk that you can throw some waste there .",January,2016,April,2016,Kristina_Bohmer,Slovakia,Europe,male,0,2,female,9
362686971_7,Taj_POS_10663_7,"Be careful because one day in week it is closed , I think it was Friday but I am not sure .",January,2016,April,2016,Kristina_Bohmer,Slovakia,Europe,male,1,1,female,9
361207746_1,Taj_POS_10742_1,"If there is one thing worth seeing in life , then this is it , all built for the love of his wife .",March,2016,April,2016,Chandresh P,United Kingdom,Europe,male,3,1,male,8
361207746_2,Taj_POS_10742_2,"The Taj is surprising at the size of it , amazing and breath taking at the same time .",March,2016,April,2016,Chandresh P,United Kingdom,Europe,male,4,2,male,8
361207746_3,Taj_POS_10742_3,Best to have a guide as they are able to give you the background .,March,2016,April,2016,Chandresh P,United Kingdom,Europe,male,3,1,male,8
361207746_4,Taj_POS_10742_4,"BTW there is a theatre production show in the evening ask your hotel about it , worth going to see it too .",March,2016,April,2016,Chandresh P,United Kingdom,Europe,male,3,1,male,8
359322571_1,Taj_POS_10841_1,"But , be prepared for the crowds of unruly visitors who expect to prolong their Kodak moments to infinity at the expense of others .",March,2016,March,2016,Sharon R,United States,North America,female,1,1,female,85
357598396_1,Taj_POS_10936_1,"A visit to the Taj is something you will never forget a must see when in India , the workmanship is wonderful .",December,2015,March,2016,Ross W,United Kingdom,Europe,male,3,1,male,81
357598396_2,Taj_POS_10936_2,"It is nice just to sit on one of the many seat and gaze at this fantastic structure , there are lots of Indian visitors and that adds the the fantastic visit .",December,2015,March,2016,Ross W,United Kingdom,Europe,male,4,2,male,81
357245114_1,Taj_POS_10950_1,"Well , It is truly one of the wonders of the world .",February,2016,March,2016,Tushar M,India,Asia,female,3,1,male,97
356976085_1,Taj_POS_10963_1,What can you say about this building except that it far superior than your imagination .,March,2016,March,2016,JustTravelAnywhere,Australia,Oceania,female,3,1,male,98
356925304_1,Taj_POS_10970_1,it is really a living palace from a real love story .,March,2016,March,2016,west_dragon,China,Asia,female,3,1,male,8
356613152_1,Taj_POS_10985_1,We went in the afternoon in the sunset and the next day in the sunrise .,March,2016,March,2016,bettina p,Uruguay,South America,male,1,1,female,9
356549217_1,Taj_POS_10992_1,We were on a short business trip for 4 days but we could not get tym for 3 days to see my favourite monument .,March,2016,March,2016,PavanDhiman,India,Asia,male,1,1,male,9
356549217_2,Taj_POS_10992_2,It was only the 4th day that we planned to go to see Taj Mahal at 6 am in the morning .,March,2016,March,2016,PavanDhiman,India,Asia,male,1,1,male,9
356549217_3,Taj_POS_10992_3,It seemed to be too early but our decision did not go in vain .,March,2016,March,2016,PavanDhiman,India,Asia,male,1,1,male,9
356549217_4,Taj_POS_10992_4,My junior had never seen the White Wonder but i had numerous times before .,March,2016,March,2016,PavanDhiman,India,Asia,male,1,1,male,9
356549217_5,Taj_POS_10992_5,And little did i realise that it was a great decision we made .,March,2016,March,2016,PavanDhiman,India,Asia,male,3,1,male,9
356549217_6,Taj_POS_10992_6,We reached the entrance by 6.45 am and boy not so many people were there .,March,2016,March,2016,PavanDhiman,India,Asia,male,1,1,male,9
356541757_1,Taj_POS_10993_1,"it was beautiful , our experienced guide and photographer just knows exactly the best spots for the photoshoot .",June,2015,March,2016,WanderYam,United Arab Emirates,Asia,female,3,1,male,8
356541757_2,Taj_POS_10993_2,"it was hot and there were lots of people in the queue , and once inside , all sorts of smell , but overall , the view was amazing .",June,2015,March,2016,WanderYam,United Arab Emirates,Asia,female,1,1,male,8
353767043_1,Taj_POS_11143_1,"We visited the taj mahal early in the morning , when it was not too crowded .",March,2016,March,2016,Severine B,Belgium,Europe,male,1,1,female,96
353767043_2,Taj_POS_11143_2,"It really is an amazing work of art , though a little smaller then i had expexted .",March,2016,March,2016,Severine B,Belgium,Europe,male,4,2,female,96
353767043_3,Taj_POS_11143_3,"Keep the ticket when you are also going to see other momuments in agra ( fort , baby taj ) .",March,2016,March,2016,Severine B,Belgium,Europe,male,1,1,female,96
353767043_4,Taj_POS_11143_4,Fyi - At this moment three of tho 4 towers are under construction .,March,2016,March,2016,Severine B,Belgium,Europe,male,2,0,female,96
353767043_5,Taj_POS_11143_5,As from april only two of them ( so they told us ) .,March,2016,March,2016,Severine B,Belgium,Europe,male,2,0,female,96
352047282_1,Taj_POS_11232_1,Agra by itself will not impress you if no agra fort and taj mahal !,April,2015,March,2016,AlionaIsebia,Georgia,Asia,female,1,1,female,8
352047282_2,Taj_POS_11232_2,I know the story behind Taj and its one side beautiful and other side cruel !,April,2015,March,2016,AlionaIsebia,Georgia,Asia,female,3,1,female,8
352047282_3,Taj_POS_11232_3,Shahjahan order to cut right hand to all who was involved in building of Taj in order no one in world will be able to build same beauty !,April,2015,March,2016,AlionaIsebia,Georgia,Asia,female,3,1,female,8
352047282_4,Taj_POS_11232_4,"On other side he built it to make people see in centuries how big his love was and how he was seeing his wife , there is a legend that he wanted to build silver bridge over Yamuna river and on other side build small black stoned tomb for himself , cz that is how he was feeling himself infront of hia wife .",April,2015,March,2016,AlionaIsebia,Georgia,Asia,female,1,1,female,8
352047282_5,Taj_POS_11232_5,But he was arrested by his son cz he was spending lot of gold and precision stones to build taj and people were suffering cz of that .,April,2015,March,2016,AlionaIsebia,Georgia,Asia,female,1,1,female,8
352047282_6,Taj_POS_11232_6,"The only thing Shahjahan ask from his son that he should put him in agra fort that from there he would be able to look at taj everyday , that is how he ended up his days , his daughter was looking after him and he did not wanted anything apart to stare at taj .",April,2015,March,2016,AlionaIsebia,Georgia,Asia,female,1,1,female,8
352047282_7,Taj_POS_11232_7,"that is a brief story about Taj , but if we will speak about Tajs beauty its might take me whole day !",April,2015,March,2016,AlionaIsebia,Georgia,Asia,female,3,1,female,8
352047282_8,Taj_POS_11232_8,"Ita such place every human must see at least once in lifetime , its big shane to visit india and nt to see taj , some tourists going from early morning until sun goes down , cz taj changing colours its yellow in morning , white in day and pink in evening .",April,2015,March,2016,AlionaIsebia,Georgia,Asia,female,1,1,female,8
352047282_9,Taj_POS_11232_9,Its incredible how beautiful build it is nothing much and nothing less its feels its been built on other planet and put it in once on earth .,April,2015,March,2016,AlionaIsebia,Georgia,Asia,female,1,1,female,8
352047282_10,Taj_POS_11232_10,"Its perfect shaped even after so many centuries , and when you see you wonder if its real , in fogy days its looks so not real you can not believe its actually realty !",April,2015,March,2016,AlionaIsebia,Georgia,Asia,female,3,1,female,8
352047282_11,Taj_POS_11232_11,The tickets cost for foreigners was 750 rupi when i was there .,April,2015,March,2016,AlionaIsebia,Georgia,Asia,female,1,1,female,8
352047282_12,Taj_POS_11232_12,"If you love to stay alone with this beauty than do not take aby guide , cz he will not let you enjoy the feelings you will get .",April,2015,March,2016,AlionaIsebia,Georgia,Asia,female,1,1,female,8
350790817_1,Taj_POS_11308_1,"This monument built for the love of a woman as to be seen , One can only stand a stare the first time you see it , The workmanship that went into this building is unbelievable .",February,2016,February,2016,Neil S,United Kingdom,Europe,male,0,2,male,80
349464661_1,Taj_POS_11387_1,Taj Mahal and surrounding village Agra are a must to have seen once .,February,2016,February,2016,Jannes N,Netherlands,Europe,female,1,1,male,9
349464661_2,Taj_POS_11387_2,Go there early in the morning so it is less crowded .,February,2016,February,2016,Jannes N,Netherlands,Europe,female,2,0,male,9
346345041_1,Taj_POS_11559_1,"A must visit to the Taj when visiting Agra , There are young men acting as guides try and find out if they charge a fee , if they say yes be careful .",November,2015,February,2016,Terry G,United Kingdom,Europe,female,1,1,male,9
346345041_2,Taj_POS_11559_2,We had a young man as a guide he was so very good and informative he did not charge any fee but because he was so good we gave him a tip of 500 rupees .,November,2015,February,2016,Terry G,United Kingdom,Europe,female,1,1,male,9
346157399_1,Taj_POS_11570_1,It feels somewhat like a pilgrimage to visit the Taj Mahal .,October,2015,February,2016,FairAir,Switzerland,Europe,male,1,1,male,9
346157399_2,Taj_POS_11570_2,The road to it and its surroundings are less than attractive .,October,2015,February,2016,FairAir,Switzerland,Europe,male,1,1,male,9
346157399_3,Taj_POS_11570_3,Still the journey is worth it just to personally view this jewel .,October,2015,February,2016,FairAir,Switzerland,Europe,male,4,2,male,9
346157399_4,Taj_POS_11570_4,"It does not look anything like the photos you see of it and its position on the river gives it a whole new appeal , as do the stories of its history .",October,2015,February,2016,FairAir,Switzerland,Europe,male,1,1,male,9
346157399_5,Taj_POS_11570_5,Definitely one of the wonders of the world that must be seen once in your life - just forget the journey !,October,2015,February,2016,FairAir,Switzerland,Europe,male,3,1,male,9
345229985_1,Taj_POS_11614_1,Was expecting to be totally underwhelmed as everyone has seen the pictures Fear not It is stunning Going with a guide was money well spent Things we would have missed were brought up In stunning clarity .,February,2016,February,2016,desdemona2123,United Kingdom,Europe,male,1,1,female,83
344750597_1,Taj_POS_11635_1,"Have come here many times , what gets my attention is that it was made when there were no machines using electricity or engines , not even a steam engine !",February,2016,February,2016,sanjay744,India,Asia,male,1,1,male,90
344750597_2,Taj_POS_11635_2,"White marble brought from over 350 kms by road , 70 % of the population of Agra , directly of indirectly gives employment .",February,2016,February,2016,sanjay744,India,Asia,male,1,1,male,90
343076962_1,Taj_POS_11729_1,The splendour of this majestic mausoleum built in the Mughal style architecture at the northern end of extensive walled gardens was designed in the style of Charbagh with an Islamic theme of Paradise We had been hoping to visit at sun set but our guide had other ideas !,December,2015,January,2016,terence s,United Kingdom,Europe,male,1,1,male,9
341380632_1,Taj_POS_11818_1,The crowds are smaller and you can see the light change on the Taj as the sun rises .,December,2015,January,2016,VanCan2012,Canada,North America,male,1,1,male,86
341380632_2,Taj_POS_11818_2,You get dropped off at a certain point and have to take short 5 minute bus ride from the parking lot to the entrance .,December,2015,January,2016,VanCan2012,Canada,North America,male,1,1,male,86
341380632_3,Taj_POS_11818_3,"You can also walk it , its about 2 km and takes 20 minutes .",December,2015,January,2016,VanCan2012,Canada,North America,male,1,1,male,86
341380632_4,Taj_POS_11818_4,This line was not too bad because we visited at 7.30 am but our guide said it gets very long as the day progresses .,December,2015,January,2016,VanCan2012,Canada,North America,male,1,1,male,86
341380632_5,Taj_POS_11818_5,"You only need to take off your shoes when you enter the actual Taj structure , otherwise you can leave them on .",December,2015,January,2016,VanCan2012,Canada,North America,male,1,1,male,86
341380632_6,Taj_POS_11818_6,If you get shoe covers then you can leave your shoes on when you enter .,December,2015,January,2016,VanCan2012,Canada,North America,male,1,1,male,86
341332264_1,Taj_POS_11827_1,"feel proud of architects , engineers & masons of that bygone era !",January,2016,January,2016,neelu2015,India,Asia,male,3,1,female,9
341332264_2,Taj_POS_11827_2,"Such a magnificent structure , holding high after hundreds of years !",January,2016,January,2016,neelu2015,India,Asia,male,4,2,female,9
341332264_3,Taj_POS_11827_3,"Best time to visit is at dawn , with less crowds & ample opportunity to savour beauty .",January,2016,January,2016,neelu2015,India,Asia,male,3,1,female,9
341332264_4,Taj_POS_11827_4,"Do leave prohibited things like power banks , tabs , even books n newspapers behind for a smooth security check .",January,2016,January,2016,neelu2015,India,Asia,male,1,1,female,9
340880961_1,Taj_POS_11853_1,"Words can not describe being there , its remarkable , beautiful , Even learnt a bit of history from the guide , you not allowed to wear shoes here or take pictures , tomestone inside .",January,2016,January,2016,Sumaya M,South Africa,Africa,female,3,1,female,8
339854529_1,Taj_POS_11914_1,I do not have to say much about the magnificence of Taj Mahal .,January,2016,January,2016,Vivek G,India,Asia,female,1,1,male,94
339854529_2,Taj_POS_11914_2,I was 4 or 5 when I first saw the Taj and I do not remember much about it .,January,2016,January,2016,Vivek G,India,Asia,female,1,1,male,94
