264494890_12,Taj_POS_15151_12,They take you about 100 meters away from the Taj's walled entrace .,April,2015,April,2015,Becky L,United Arab Emirates,Asia,male,2,0,female,8
264494890_13,Taj_POS_15151_13,"As you are walking up to this walled entrance , tons of souvenir hawkers around .",April,2015,April,2015,Becky L,United Arab Emirates,Asia,male,1,1,female,8
264494890_14,Taj_POS_15151_14,Head left as you approach the walled entrance - this is where the lines form along rails depending on what type of ticket you have .,April,2015,April,2015,Becky L,United Arab Emirates,Asia,male,1,1,female,8
264494890_15,Taj_POS_15151_15,"You turn in your ticket , the guards go through your bags - do not have crayons , any types of books , etc .",April,2015,April,2015,Becky L,United Arab Emirates,Asia,male,1,1,female,8
264494890_16,Taj_POS_15151_16,"Once you get through , you are inside the Taj compound and you walk straight , then right through an archway - and there is the Taj .",April,2015,April,2015,Becky L,United Arab Emirates,Asia,male,1,1,female,8
264494890_17,Taj_POS_15151_17,Remember - the Taj is located in a compound of seven buildings with a huge wall around it .,April,2015,April,2015,Becky L,United Arab Emirates,Asia,male,2,0,female,8
264494890_18,Taj_POS_15151_18,"When we were there , it was hot and there were tons of people there - the line to get in was about 300 deep , so be prepared for a long wait .",April,2015,April,2015,Becky L,United Arab Emirates,Asia,male,1,1,female,8
264494890_19,Taj_POS_15151_19,"When you come back out , your cart / horse will be waiting for you ( do not pay until the end ) .",April,2015,April,2015,Becky L,United Arab Emirates,Asia,male,1,1,female,8
264494890_20,Taj_POS_15151_20,"Make sure he does not try to trick you into paying twice what you agreed - 300 up and 300 back When you first make the deal , say both ways 300 Rupees so he can not trick you , Enjoy !",April,2015,April,2015,Becky L,United Arab Emirates,Asia,male,1,1,female,8
263885494_1,Taj_POS_15179_1,awesome experience what a view great it remembers me the time mughals .,February,2015,April,2015,ojas575,India,Asia,female,3,1,male,9
263836980_1,Taj_POS_15182_1,"went early at sunrise , before the gates opened and got in line .",March,2015,April,2015,Denise D,Canada,North America,male,2,0,female,9
263836980_2,Taj_POS_15182_2,"At the entrance , women are in one line , men in another .",March,2015,April,2015,Denise D,Canada,North America,male,2,0,female,9
263341722_1,Taj_POS_15207_1,I have seen a lot of landmarks in the vast amount of travelling I have done but the Taj was a vision of beauty .,February,2015,April,2015,BarbN01,Canada,North America,male,3,1,female,86
263341722_2,Taj_POS_15207_2,I was fortunate to be able to stand at the end of the pools and take photos with the perfect reflection of Taj Mahal in it .,February,2015,April,2015,BarbN01,Canada,North America,male,3,1,female,86
263341722_3,Taj_POS_15207_3,"And of course , you need to get the picture pinching the top of the Taj .",February,2015,April,2015,BarbN01,Canada,North America,male,1,1,female,86
262934451_1,Taj_POS_15227_1,The view of the main building from the gate itself gives you the chills .,March,2015,March,2015,Pratik D,India,Asia,male,3,1,male,8
262934451_2,Taj_POS_15227_2,Spending time in the complex just gives you the best feeling ever !,March,2015,March,2015,Pratik D,India,Asia,male,4,2,male,8
262382503_1,Taj_POS_15258_1,I would recommend that one takes one of the economy hotels within the city from where one can walk to the Taj .,February,2015,March,2015,Ann F,Austria,Europe,male,3,1,female,9
261420964_1,Taj_POS_15311_1,Anyone that comes to India MUST make the effort to visit the Taj Mahal .,March,2015,March,2015,Torie113,United Kingdom,Europe,male,1,1,female,95
261420964_2,Taj_POS_15311_2,It is absolutely beautiful and learning about the story behind it makes the experience so much more special .,March,2015,March,2015,Torie113,United Kingdom,Europe,male,4,2,female,95
260040274_1,Taj_POS_15400_1,"it is a must see almost ruined by the approach road and the tedious security search before entry , actually best seen from the other side of the Yamuna river for better pictures and less crowds .",March,2015,March,2015,Paul E,United Kingdom,Europe,male,1,1,male,8
259563967_1,Taj_POS_15424_1,"We went at sunset and sunrise , both spectacular but less crowded with fewer hustlers at sunrise .",March,2015,March,2015,charlotte d,United Kingdom,Europe,female,1,1,female,9
259563967_2,Taj_POS_15424_2,Seeing it twice meant that I was really able to enjoy it fully the second time not only because it was less crowded but also because I was not looking at this amazing monument from behind a camera !,March,2015,March,2015,charlotte d,United Kingdom,Europe,female,4,2,female,9
259196339_1,Taj_POS_15450_1,"a must see , place for anyone who visits India , spent 3 days in Agra at most 2 were needed , other than the Taj Mahal and Agra fort there is not a lot different to see in the area than any other area in India .",March,2015,March,2015,gareth67,Germany,Europe,female,1,1,male,8
258897364_1,Taj_POS_15475_1,I have been to Taj Mahal at least twice before but never does it cease to amaze me .,February,2015,March,2015,Summer F,Canada,North America,male,1,1,female,8
258897364_2,Taj_POS_15475_2,The beauty of the place is truly marvelous and the various folklores associated make it even more intriguing and worthy visit .,February,2015,March,2015,Summer F,Canada,North America,male,4,2,female,8
258897364_3,Taj_POS_15475_3,All said the crowd is still a struggle for me but then you could very well imagine that a monument so popular and admired by millions would be crowded .,February,2015,March,2015,Summer F,Canada,North America,male,3,1,female,8
258497663_1,Taj_POS_15503_1,I have seen the Taj five times and everytime I see it I realize why it is considered one of the wonders of this world .,March,2015,March,2015,Anuj2010,India,Asia,male,3,1,male,9
258497663_2,Taj_POS_15503_2,"The intricate artwork , the inlaid stones and the grand marble structure against a blue sky .",March,2015,March,2015,Anuj2010,India,Asia,male,3,1,male,9
258321896_1,Taj_POS_15516_1,You will have seen photos or read about the Taj Mahal prior to visiting but neither will prepare you for the stunning beauty or the shear scale of this must see monument .,January,2015,March,2015,stephen0654,United Kingdom,Europe,male,2,0,male,82
258321896_2,Taj_POS_15516_2,The place was packed with visitors when we were there but it did not detract from our experience .,January,2015,March,2015,stephen0654,United Kingdom,Europe,male,1,1,male,82
257967785_1,Taj_POS_15543_1,"just be careful off photo touts , and the amount off things you can not walk in with , .",February,2015,March,2015,joe j,United Kingdom,Europe,male,1,1,male,9
256495033_1,Taj_POS_15625_1,The Taj Mahal is everything it is cracked up to be and a marvellous example of the skills of builders and architects from centuries ago .,February,2015,February,2015,timothyP,Afghanistan,Asia,male,1,1,male,99
256495033_2,Taj_POS_15625_2,"However , it is crowded and there are touts on the approach roads and inside there are photographers conning you into 's pecial photos Needless to say we fell for it ( and actually quite liked them ) .",February,2015,February,2015,timothyP,Afghanistan,Asia,male,2,0,male,99
256495033_3,Taj_POS_15625_3,The biggest disappointment was inside the tomb where we were herded around like sheep with no chance of studying the tombs .,February,2015,February,2015,timothyP,Afghanistan,Asia,male,0,2,male,99
256112084_1,Taj_POS_15657_1,"To our delight , we were allowed to enter the Taj Mahal , so it was not just the photo opportunity on the outside , but the lovely walk towards the building and then inside .",February,2015,February,2015,PaulineNorway,Norway,Europe,male,3,1,female,86
256112084_2,Taj_POS_15657_2,it is not exactly a landmark you would miss out on a trip to India - but you can look forward to it in the knowledge that it will fulfill all your expectations - and more !,February,2015,February,2015,PaulineNorway,Norway,Europe,male,3,1,female,86
256110382_1,Taj_POS_15658_1,To be honest I was a bit underwhelmed after my visit .,February,2015,February,2015,Eben v,South Africa,Africa,male,2,0,male,92
256110382_2,Taj_POS_15658_2,Much smaller than I thought and after seeing all the pictures I was not too impressed .,February,2015,February,2015,Eben v,South Africa,Africa,male,2,0,male,92
256110382_3,Taj_POS_15658_3,For the Rs750 entry you do not get much in return .,February,2015,February,2015,Eben v,South Africa,Africa,male,2,0,male,92
256110382_4,Taj_POS_15658_4,"If you or not on an orginised tour or paying a tout , pretending to be a government guide , you are on your own .",February,2015,February,2015,Eben v,South Africa,Africa,male,1,1,male,92
256110382_5,Taj_POS_15658_5,Be sure to collect your water and shoe covers next to the ticket office .,February,2015,February,2015,Eben v,South Africa,Africa,male,1,1,male,92
256110382_6,Taj_POS_15658_6,No one tells you this and it is included in your inflated ticket price .,February,2015,February,2015,Eben v,South Africa,Africa,male,1,1,male,92
256110382_7,Taj_POS_15658_7,I suspect no one tells you this because then you have to buy shoe covers inside .,February,2015,February,2015,Eben v,South Africa,Africa,male,1,1,male,92
256110382_8,Taj_POS_15658_8,Take an old expired passport if you have as you have to leave your passport as security .,February,2015,February,2015,Eben v,South Africa,Africa,male,1,1,male,92
256110382_9,Taj_POS_15658_9,Everybody seems to be out to make money from the tourists .,February,2015,February,2015,Eben v,South Africa,Africa,male,2,0,male,92
256110382_10,Taj_POS_15658_10,Agra really has nothing to offer other than the Taj and everybody wants a piece of the tourist pie .,February,2015,February,2015,Eben v,South Africa,Africa,male,1,1,male,92
255356389_1,Taj_POS_15698_1,If in big group it is better to hire Guide ( Rs .,January,2015,February,2015,reena56,India,Asia,male,1,1,female,86
255356389_2,Taj_POS_15698_2,It will take at least 1 to 1 / 12 hrs to nicely visit each of the area and doing photography from recommended pints .,January,2015,February,2015,reena56,India,Asia,male,3,1,female,86
255356389_3,Taj_POS_15698_3,Ask the guids to show the photograph point from where it will look like you are touching the top of the monument or you are holding the monument in your hand .,January,2015,February,2015,reena56,India,Asia,male,1,1,female,86
255356389_4,Taj_POS_15698_4,But beware of the shopping area outside the monument which are looting the tourists .,January,2015,February,2015,reena56,India,Asia,male,1,1,female,86
254061589_1,Taj_POS_15777_1,Learnt that Taj Mahal remains closed on Fridays followed by huge rush on saturday and sunday .,February,2015,February,2015,99Bhupendra,India,Asia,male,1,1,male,90
254061589_2,Taj_POS_15777_2,"In 10-15 minutes , I was inside and got to see the awe inspiring beauty of the world - The TAJ MAHAL PALACE for the first time .",February,2015,February,2015,99Bhupendra,India,Asia,male,3,1,male,90
254061589_3,Taj_POS_15777_3,You would be chased by lots of photographers and guides inside .,February,2015,February,2015,99Bhupendra,India,Asia,male,1,1,male,90
254061589_4,Taj_POS_15777_4,"I saw lot of Japanese , American , Arabs , European people there .",February,2015,February,2015,99Bhupendra,India,Asia,male,2,0,male,90
254061589_5,Taj_POS_15777_5,We saw the Taj Mahal from all sides and clicked photos from our phone camera ( its free to click photo from phone camera ) .,February,2015,February,2015,99Bhupendra,India,Asia,male,1,1,male,90
254061589_6,Taj_POS_15777_6,Its worth going for Taj Mahal atleast once in your lifetime .,February,2015,February,2015,99Bhupendra,India,Asia,male,3,1,male,90
253833685_1,Taj_POS_15798_1,"The beauty and atmosphere of this place is overwhelming , you can see in every detail of the place the reason why this is considered one of the modern world wonders .",June,2014,February,2015,AngelicaDelHierro,Mexico,North America,female,3,1,female,8
253833685_2,Taj_POS_15798_2,"We arrived before 6am to beat the crowds and the heat , at it was totally worth it .",June,2014,February,2015,AngelicaDelHierro,Mexico,North America,female,3,1,female,8
253833685_3,Taj_POS_15798_3,"Note that your belongings are searched at the entrances for prohibited items , among the items that you can not take inside are flags or other items that relate to other countries so you have to take this in mind .",June,2014,February,2015,AngelicaDelHierro,Mexico,North America,female,1,1,female,8
253833685_4,Taj_POS_15798_4,You are not allowed to take a picture of yourself with your country flag .,June,2014,February,2015,AngelicaDelHierro,Mexico,North America,female,1,1,female,8
253833685_5,Taj_POS_15798_5,"Also be careful about the photographers for hire , they will find you outside with a printed album given at outrageous prices .",June,2014,February,2015,AngelicaDelHierro,Mexico,North America,female,1,1,female,8
253833685_6,Taj_POS_15798_6,"If you do hire them be careful about the amount of pictures you allow them to take , select your poses well to avoid this issue .",June,2014,February,2015,AngelicaDelHierro,Mexico,North America,female,1,1,female,8
253833685_7,Taj_POS_15798_7,"My friend and I bought a spree to wear for the pictures , I totally recommend doing this !",June,2014,February,2015,AngelicaDelHierro,Mexico,North America,female,3,1,female,8
253158783_1,Taj_POS_15832_1,My first trip to the Taj and full of trepidation the Taj did not dissapoint .,February,2015,February,2015,RogerRFC,United Kingdom,Europe,male,1,1,male,95
253158783_2,Taj_POS_15832_2,The battery operated trucks to enter the grounds were a surprise but not a dissapointment .,February,2015,February,2015,RogerRFC,United Kingdom,Europe,male,1,1,male,95
253158783_3,Taj_POS_15832_3,The tomb is a fantastic building and it is well managed .,February,2015,February,2015,RogerRFC,United Kingdom,Europe,male,3,1,male,95
253158783_4,Taj_POS_15832_4,We had plenty of time to view the building and enjoy the atmosphere of the history of the building .,February,2015,February,2015,RogerRFC,United Kingdom,Europe,male,2,0,male,95
253158783_5,Taj_POS_15832_5,Visiting here is a must when in Agra we did it independently and it worked out fine .,February,2015,February,2015,RogerRFC,United Kingdom,Europe,male,3,1,male,95
253158783_6,Taj_POS_15832_6,This is a world famous attraction and one that should not be missed .,February,2015,February,2015,RogerRFC,United Kingdom,Europe,male,2,0,male,95
251023703_1,Taj_POS_15958_1,I visited the Taj Mahal in January 2014 it was on my bucket list of things to do .,February,2014,January,2015,62Denise,New Zealand,Oceania,female,1,1,female,9
251023703_2,Taj_POS_15958_2,"After going through tight security we finally got in , and there it was in front of me the Taj , the tears welled up in my throat it was such an emotional feeling seeing it for the first time .",February,2014,January,2015,62Denise,New Zealand,Oceania,female,3,1,female,9
251023703_3,Taj_POS_15958_3,"We went early in the morning a little foggy but still managed to get good photos , watch out for all the hwakers and beggars if you say yes to one you will never get rid of them , they follow you everywhere very annoying after a couple of hours .",February,2014,January,2015,62Denise,New Zealand,Oceania,female,1,1,female,9
250205341_1,Taj_POS_15989_1,"there can never be enough words to say about taj , it is breathtaking , one look at it and you feel like staying there forever just watching it .",December,2014,January,2015,gaurav0481,India,Asia,female,3,1,male,9
250188081_1,Taj_POS_15992_1,Agra tends to get too foggy early in the morning from November to end of January so I first went with my group to Agra Fort and to the Taj Mahal in the afternoon when it was also less crowded .,January,2015,January,2015,Christopher P,Greece,Europe,female,1,1,male,97
250188081_2,Taj_POS_15992_2,"It used to take too long to get in , but now the whole process is a lot quicker , but the security check far too strict !",January,2015,January,2015,Christopher P,Greece,Europe,female,1,1,male,97
250188081_3,Taj_POS_15992_3,"Bring as little as possible - just your camera , mobile phone and wallet , as lighters , pens , chewing gum and generally anything sharp will be confiscated .",January,2015,January,2015,Christopher P,Greece,Europe,female,1,1,male,97
249688946_1,Taj_POS_16022_1,"This was our 2nd visit , however it was as captivating as first time .",December,2014,January,2015,indi_ashu,India,Asia,male,1,1,female,8
249688946_2,Taj_POS_16022_2,Should be at the top of the list of must see places before you die .,December,2014,January,2015,indi_ashu,India,Asia,male,1,1,female,8
248843955_1,Taj_POS_16061_1,Have seen so many pictures of it and to see it in person it was amazing .,January,2015,January,2015,Louise2186,Switzerland,Europe,male,3,1,female,80
248843955_2,Taj_POS_16061_2,It has far more detail on it when you get up close than you could imagine from all the pictures taken far away .,January,2015,January,2015,Louise2186,Switzerland,Europe,male,2,0,female,80
248843955_3,Taj_POS_16061_3,"December / January is not the best time to visit though as there is a lot of fog , although we were quite lucky to be able to see it .",January,2015,January,2015,Louise2186,Switzerland,Europe,male,1,1,female,80
247938404_1,Taj_POS_16121_1,The ASI and CISF do a relatively good job of regulating visitors .,January,2015,January,2015,sanjay_ska,India,Asia,male,3,1,male,90
247938404_2,Taj_POS_16121_2,"However , signages at key points in the area would help the visitors who do not want to avail the services of any of the cluster of guides who descend upon any visitor .",January,2015,January,2015,sanjay_ska,India,Asia,male,2,0,male,90
247530555_1,Taj_POS_16145_1,One of the wonders of the modern world is truly a wonder .,January,2015,January,2015,VikramVishwanath,India,Asia,male,3,1,male,8
247530555_2,Taj_POS_16145_2,It is certainly one of the best built by the mughals .,January,2015,January,2015,VikramVishwanath,India,Asia,male,4,2,male,8
246944880_1,Taj_POS_16174_1,"Was fairly busy when I was there , but was just fantastic .",December,2014,January,2015,David T,Australia,Oceania,female,3,1,male,8
246944880_2,Taj_POS_16174_2,Big thing to tick off in a wonderful setting on the river .,December,2014,January,2015,David T,Australia,Oceania,female,3,1,male,8
246944880_3,Taj_POS_16174_3,Went across the river to get another view the next day .,December,2014,January,2015,David T,Australia,Oceania,female,1,1,male,8
244950509_1,Taj_POS_16293_1,Visiting the taj Mahal was a stand out moment in my life that i will cherish forever .,,,December,2014,KatieKairns,Ireland,Europe,male,1,1,female,82
244950509_2,Taj_POS_16293_2,It was world heritage day so our admission was free and as a result it was quite busy but the taj is so impressive this did not matter .,,,December,2014,KatieKairns,Ireland,Europe,male,3,1,female,82
244950509_3,Taj_POS_16293_3,I went at dawn and the mist present affected picture quality but by 9am the sky was blue .,,,December,2014,KatieKairns,Ireland,Europe,male,2,0,female,82
243900110_1,Taj_POS_16359_1,"Raj was a fabulous guide and provided us with a historical and humanistic overview of Agra , the Agra Fort , the Taj Mahal and the wonderful arts and crafts of the Agra area .",November,2014,December,2014,Judy M,Canada,North America,female,3,1,female,8
243900110_2,Taj_POS_16359_2,We would highly recommend Raj if doing a tour in Agra .,November,2014,December,2014,Judy M,Canada,North America,female,1,1,female,8
243865009_1,Taj_POS_16361_1,There are many reasons why the Taj is generally thought to be the epitome of extraordinary architecture and the acme of one of the world's most famous love stories .,December,2014,December,2014,Joel_Andrews28,United States,North America,female,3,1,male,8
243865009_2,Taj_POS_16361_2,"Although I visited the Taj over 40 years ago ( in 1970 ) I can still visualize its perfect symmetry , its white dome against the blue sky , closeups of colorful gems set in white stone , its reflecting pool , its inside shaded coolness vs .",December,2014,December,2014,Joel_Andrews28,United States,North America,female,3,1,male,8
243106627_1,Taj_POS_16416_1,It great to see the mix of people and the calm inside from the craziness of the streets .,March,2014,December,2014,Nicholas_Booth_1981,France,Europe,female,3,1,male,9
241737134_1,Taj_POS_16501_1,Much made of a sunrise visit for early light to bring out the splender of the marble .,November,2014,November,2014,Tom M,United Kingdom,Europe,male,1,1,male,92
241737134_2,Taj_POS_16501_2,"This will not happen if surrounded by haze , mist and pollution which is common .",November,2014,November,2014,Tom M,United Kingdom,Europe,male,1,1,male,92
241737134_3,Taj_POS_16501_3,"We chose the sunny , late afternoon and were not disappointed as next morning was very indeed hazy .",November,2014,November,2014,Tom M,United Kingdom,Europe,male,1,1,male,92
241737134_4,Taj_POS_16501_4,Foreigners pay 7.50 for a ticket rather than the locals who pay less than 1 .,November,2014,November,2014,Tom M,United Kingdom,Europe,male,1,1,male,92
241737134_5,Taj_POS_16501_5,"However once inside the grounds as a VIP , you skip hour long queues to enter the building itself .",November,2014,November,2014,Tom M,United Kingdom,Europe,male,1,1,male,92
241737134_6,Taj_POS_16501_6,"Patience needed to get a decent photo of the Princess Diana seat , likewise reflections in the pools due to the crowds .",November,2014,November,2014,Tom M,United Kingdom,Europe,male,2,0,male,92
241737134_7,Taj_POS_16501_7,Afterwards we drove over the river to the Mahtab Bagh Gardens to get a great view of the Taj at sunset .,November,2014,November,2014,Tom M,United Kingdom,Europe,male,1,1,male,92
241737134_8,Taj_POS_16501_8,Level easy walking with a few steps apart from the mausolem .,November,2014,November,2014,Tom M,United Kingdom,Europe,male,3,1,male,92
241506330_1,Taj_POS_16514_1,Taj Mahal what it appears in the picture is quite different from the way you look .,November,2014,November,2014,Prasun_Patel,India,Asia,male,1,1,male,92
241506330_2,Taj_POS_16514_2,the construction which took place ages ago still appears to be constructed recently .,November,2014,November,2014,Prasun_Patel,India,Asia,male,2,0,male,92
241506330_3,Taj_POS_16514_3,"The way science was been used is just amazing ( For ex - from the main entrance you see the Taj it appears to be just few steps away , the illusion is created in such a way and when you are out of the main entrance you can see its quite far away .",November,2014,November,2014,Prasun_Patel,India,Asia,male,3,1,male,92
241506330_4,Taj_POS_16514_4,Gems and Stones which are embedded on the Taj appears to be like glittering lights .,November,2014,November,2014,Prasun_Patel,India,Asia,male,1,1,male,92
241506330_5,Taj_POS_16514_5,"Taj look alike from all 4 side and the 4 minar are constructed outwards , if any natural calamities occur the minar do not fall on Taj Do take a guide he would charge anything from 200-550 , go with the registered guide who will help you to bypass all the waiting ques at the entrance and also the ticket ques where one can spend up to 2 hours .",November,2014,November,2014,Prasun_Patel,India,Asia,male,1,1,male,92
240512725_1,Taj_POS_16578_1,"This awesome and majestical celebration of love is truly amazing , but more so when seen through the anguished eyes of its creator - the truest of lovers .",September,2014,November,2014,Philip B,Australia,Oceania,male,3,1,male,9
240512725_2,Taj_POS_16578_2,"One must therefore visit the lofty galleries of Agra's Fort and stand where Shah Jahan spent his last years in captivity , gazing across a separating bend of the Yamuna River , ever beholding perhaps the greatest tribute to devoted love the world has ever seen .",September,2014,November,2014,Philip B,Australia,Oceania,male,3,1,male,9
240512725_3,Taj_POS_16578_3,Sleep now in peace Shah Jahan with your much loved Mumtaz .,September,2014,November,2014,Philip B,Australia,Oceania,male,3,1,male,9
240174772_1,Taj_POS_16608_1,I started the journey from Noida and on to the new highway to Agra .,October,2014,November,2014,Dr Neerja L B,India,Asia,male,2,0,female,84
240174772_2,Taj_POS_16608_2,The road is really good and toll booths warn you of tyre burst if you step on the pedal too much .,October,2014,November,2014,Dr Neerja L B,India,Asia,male,1,1,female,84
240174772_3,Taj_POS_16608_3,It is a good thing that the Government of Idia now has new rules for visiting Taj .,October,2014,November,2014,Dr Neerja L B,India,Asia,male,3,1,female,84
240174772_4,Taj_POS_16608_4,"We had to park our vehicle in a designated car park and from there one could carry on foot , solar powered bus , or a horse cart .",October,2014,November,2014,Dr Neerja L B,India,Asia,male,1,1,female,84
240174772_5,Taj_POS_16608_5,"Obviously we chose the latter for the fun of it , it is called a tanga in local parlance .",October,2014,November,2014,Dr Neerja L B,India,Asia,male,3,1,female,84
240174772_6,Taj_POS_16608_6,All this to avoid pollutants contaminating this monument of love and beauty .,October,2014,November,2014,Dr Neerja L B,India,Asia,male,2,0,female,84
240174772_7,Taj_POS_16608_7,"The lines inside are serpentine , but one can buy a priority ticket and avoid those lines .",October,2014,November,2014,Dr Neerja L B,India,Asia,male,1,1,female,84
240174772_8,Taj_POS_16608_8,"The rates keep changing , but are all listed , and its manned by authentic persons and not touts .",October,2014,November,2014,Dr Neerja L B,India,Asia,male,1,1,female,84
