520565330_2,Taj_POS_5432_2,"This is why I travel ( and am broke If you are reading this , I guess we think alike .",August,2017,September,2017,Cameron Y,New Zealand,Oceania,female,1,1,male,78
520565330_3,Taj_POS_5432_3,"Tickets are Rp1000 ( about $ US15 ) each for foreigners , An electric powered shuttle will take you to the gates .",August,2017,September,2017,Cameron Y,New Zealand,Oceania,female,3,1,male,78
520565330_4,Taj_POS_5432_4,We did not even take in the water bottle - just what we were wearing and our cameras .,August,2017,September,2017,Cameron Y,New Zealand,Oceania,female,1,1,male,78
520565330_5,Taj_POS_5432_5,You will get the opportunity take those iconic pictures without too much hassle .,August,2017,September,2017,Cameron Y,New Zealand,Oceania,female,1,1,male,78
520565330_6,Taj_POS_5432_6,People were really good and took turns taking photos from key spots .,August,2017,September,2017,Cameron Y,New Zealand,Oceania,female,3,1,male,78
520565330_7,Taj_POS_5432_7,Wearing unsuitable outfits and doing silly poses may incur the wrath of the security people plus prove to others that you are as silly as you look .,August,2017,September,2017,Cameron Y,New Zealand,Oceania,female,1,1,male,78
520565330_8,Taj_POS_5432_8,You will be provided with shoe covers to wear when you go inside .,August,2017,September,2017,Cameron Y,New Zealand,Oceania,female,1,1,male,78
520565330_9,Taj_POS_5432_9,"Travel writing would be a dream job for many of us , .",August,2017,September,2017,Cameron Y,New Zealand,Oceania,female,3,1,male,78
514290517_1,Taj_POS_5538_1,"The Taj Mahal is just as beautiful as all the legends , songs and travel books say .",February,2017,August,2017,EmEfGee,Ireland,Europe,male,3,1,female,8
514290517_2,Taj_POS_5538_2,Best admired from a distance for its perspective and the beautiful mysterious romance of it all .,February,2017,August,2017,EmEfGee,Ireland,Europe,male,3,1,female,8
514290517_3,Taj_POS_5538_3,Not so much to see close up but it is an architectural feast for the eye .,February,2017,August,2017,EmEfGee,Ireland,Europe,male,1,1,female,8
514290517_4,Taj_POS_5538_4,Ours was informative and helpful and full of interesting snippets of lore and history .,February,2017,August,2017,EmEfGee,Ireland,Europe,male,4,2,female,8
510310760_1,Taj_POS_5607_1,We had a blast at our sunrise visit in May 2017 .,May,2017,August,2017,LauraS5587,New Zealand,Oceania,female,1,1,female,8
509251483_1,Taj_POS_5623_1,Travelers to Delhi are well advised to spend a day traveling down to Agra for a Taj Tour .,July,2017,August,2017,Mark B,Australia,Oceania,male,1,1,male,79
509104906_1,Taj_POS_5625_1,I wish I had spent more in the gardens and more time just chilling instead of continually moving forward to look inside .,August,2017,August,2017,Happiness098,United Kingdom,Europe,male,1,1,female,97
505377023_1,Taj_POS_5691_1,They are in the middle of a 2 1 / 2 year cleaning project which means that currently one of towers and part of the front is covered by scaffolding .,July,2017,July,2017,AnnaD66,United Kingdom,Europe,male,2,0,female,80
505377023_2,Taj_POS_5691_2,When this is finished the domes are next to be cleaned .,July,2017,July,2017,AnnaD66,United Kingdom,Europe,male,2,0,female,80
505377023_3,Taj_POS_5691_3,For me the rain and scaffolding did not put me off at all .,July,2017,July,2017,AnnaD66,United Kingdom,Europe,male,1,1,female,80
505377023_4,Taj_POS_5691_4,"It was still a magical , moving place and well worth a visit .",July,2017,July,2017,AnnaD66,United Kingdom,Europe,male,4,2,female,80
505377023_5,Taj_POS_5691_5,We went at 5.30 for the sunrise but it was wet and cloudy .,July,2017,July,2017,AnnaD66,United Kingdom,Europe,male,1,1,female,80
505377023_6,Taj_POS_5691_6,July is not the best time of year to visit but it is still great .,July,2017,July,2017,AnnaD66,United Kingdom,Europe,male,3,1,female,80
505377023_7,Taj_POS_5691_7,I hope to go back one day when it is cooler and the cleaning is finished .,July,2017,July,2017,AnnaD66,United Kingdom,Europe,male,2,0,female,80
500128966_1,Taj_POS_5793_1,I believe it is one of the best monuments I have ever been .,August,2016,July,2017,Anirban R,India,Asia,male,3,1,male,8
499092432_1,Taj_POS_5820_1,"When in India go to Taj , that should be a line displayed on every ad promoting this huge and diverse country .",June,2017,July,2017,Angel_Monroy,United Arab Emirates,Asia,female,3,1,male,8
499092432_2,Taj_POS_5820_2,"Yes , every city has a significant dose of chaos , traffic , and pollution ( like any other developing country , as a Mexican I know what I am saying ) but after having all your senses stimulated visiting forts , Maharajas palaces , museums , and landmarks in other Indian cities , the Taj Mahal remains as it was intended .",June,2017,July,2017,Angel_Monroy,United Arab Emirates,Asia,female,1,1,male,8
499092432_3,Taj_POS_5820_3,"Yes , you might find long queues ( or not if you hire a tour guide in advance yes , is crowded ( and the later your visit is more crowded it will be yes , is a clich ( which any other World's landmark is not ) ?",June,2017,July,2017,Angel_Monroy,United Arab Emirates,Asia,female,1,1,male,8
499092432_4,Taj_POS_5820_4,", But , is worth it , every minute spent , every drop of sweat blurring your eyesight , every word spoken by your guide will help you to realize that this is a country with an immense heritage , a mix of civilizations , religions , and traditions .",June,2017,July,2017,Angel_Monroy,United Arab Emirates,Asia,female,3,1,male,8
499092432_5,Taj_POS_5820_5,"And also that beyond conquests , battles , and artistic expressions , love plays an important part in a country's history .",June,2017,July,2017,Angel_Monroy,United Arab Emirates,Asia,female,3,1,male,8
499092432_6,Taj_POS_5820_6,"As I said before , When in India , go to Taj .",June,2017,July,2017,Angel_Monroy,United Arab Emirates,Asia,female,1,1,male,8
499092432_7,Taj_POS_5820_7,"The monument is going under an extensive renovation , so now it has recovered almost in all its sides its infamous whiteness .",June,2017,July,2017,Angel_Monroy,United Arab Emirates,Asia,female,1,1,male,8
499067577_1,Taj_POS_5822_1,"A lot of People , of course , and very hot .",August,2016,July,2017,Gunhild S,Norway,Europe,female,3,1,female,8
499067577_2,Taj_POS_5822_2,Big and nice building The narrow street outside the area is also worth to see .,August,2016,July,2017,Gunhild S,Norway,Europe,female,3,1,female,8
492880844_1,Taj_POS_5967_1,"For me , the most mind-blowing part is that nothing I saw of the artwork and design was painted - everything was stone inlay in the white marble .",June,2017,June,2017,andrew12341,Australia,Oceania,female,1,1,male,9
491146655_1,Taj_POS_6011_1,"Located on the banks of the river Yamuna , this pure white marble mausoleum is perfectly symmetrical and was completed in mid 17 century as a tribute to Begum Mumtaz Mahal , by her husband .",June,2017,June,2017,Narendra B,India,Asia,male,3,1,male,85
488790052_1,Taj_POS_6071_1,"If you are like me , you have probably spent years dreaming about seeing the Taj Mahal .",May,2017,May,2017,CathyJ9b,Canada,North America,male,1,1,female,79
488790052_2,Taj_POS_6071_2,We were so fortunate to have a wonderful guide who took us at sunset to see the back of the Taj and the next morning to see the Taj at sunrise from the front .,May,2017,May,2017,CathyJ9b,Canada,North America,male,1,1,female,79
488276084_1,Taj_POS_6094_1,I had read to such about the Taj Mahal I was afraid it would not live upto expectations .,May,2017,May,2017,Sharon C,United Kingdom,Europe,male,2,0,female,88
488276084_2,Taj_POS_6094_2,"I need not have worried , despite the crowds ( only to be expected ) it is the MOST magical place on earth .",May,2017,May,2017,Sharon C,United Kingdom,Europe,male,1,1,female,88
487902976_1,Taj_POS_6108_1,The Taj Mahal has got to be the most impressive building I have seen in my life .,May,2017,May,2017,benjamin9244,Singapore,Asia,female,3,1,male,8
487902976_2,Taj_POS_6108_2,"it is simply breathtaking , regardless of which angle you look at it from .",May,2017,May,2017,benjamin9244,Singapore,Asia,female,4,2,male,8
485790725_1,Taj_POS_6163_1,"Morning ticket office opening at 5:15 , west gate opening at 5:30am .",May,2017,May,2017,TimO811,Australia,Oceania,male,1,1,male,9
485790725_2,Taj_POS_6163_2,( As of May 18th ) Front right minaret covered in scaffold as well as one side of Taj itself .,May,2017,May,2017,TimO811,Australia,Oceania,male,1,1,male,9
485675335_1,Taj_POS_6165_1,If your a foreigner do not forget your passport for ID .,November,2016,May,2017,RogerRFC,United Kingdom,Europe,male,2,0,male,95
485675335_2,Taj_POS_6165_2,A guide is not necessary but does help to get you through the formalities of the visit .,November,2016,May,2017,RogerRFC,United Kingdom,Europe,male,1,1,male,95
485675335_3,Taj_POS_6165_3,The history and beauty of the Taj speaks for itself a must see at least once .,November,2016,May,2017,RogerRFC,United Kingdom,Europe,male,3,1,male,95
485675335_4,Taj_POS_6165_4,You are not allowed to carry lots of accessories into the Taj so bear this in mind .,November,2016,May,2017,RogerRFC,United Kingdom,Europe,male,1,1,male,95
482707059_1,Taj_POS_6266_1,Coming upon the sight of the Taj at dawn is so moving it brings tears to the eyes .,May,2017,May,2017,Gwendolina10,United Kingdom,Europe,female,4,2,female,83
482707059_2,Taj_POS_6266_2,The back story is emotional and the detail in this building is remarkable .,May,2017,May,2017,Gwendolina10,United Kingdom,Europe,female,4,2,female,83
482707059_3,Taj_POS_6266_3,If you see only one thing in Agra it should be this !,May,2017,May,2017,Gwendolina10,United Kingdom,Europe,female,2,0,female,83
481310995_1,Taj_POS_6317_1,We had to have a guide which we did not want .,February,2017,May,2017,478pam,United Kingdom,Europe,male,1,1,female,78
479030506_1,Taj_POS_6398_1,"Awesome , it gets really hot around , try to visit the place either early morning or after 4:30 pm .",April,2017,April,2017,MeenakshiGoyal,India,Asia,female,1,1,female,8
477454966_1,Taj_POS_6454_1,"The views from outside are nice , the gardens well taken care of .",April,2017,April,2017,Miguel Z,Spain,Europe,male,3,1,male,9
477454966_2,Taj_POS_6454_2,"But the interior , it is simple , nothing to see !",April,2017,April,2017,Miguel Z,Spain,Europe,male,1,1,male,9
477454966_3,Taj_POS_6454_3,"The tourists do not care where they are , all the time speaking loudly .",April,2017,April,2017,Miguel Z,Spain,Europe,male,1,1,male,9
477454966_4,Taj_POS_6454_4,"The typical place for go , take the picture and leave to another place .",April,2017,April,2017,Miguel Z,Spain,Europe,male,1,1,male,9
477454966_5,Taj_POS_6454_5,"Could stay in the gardens , but there are too many tourist .",April,2017,April,2017,Miguel Z,Spain,Europe,male,1,1,male,9
476906244_1,Taj_POS_6483_1,This monument of love is a breathtaking beauty but few know that it is an architectural wonder and made with mathematical calculations The white marble structure has coloured stone inlays and beautiful calligraphy it is a must place to see if any one is visiting North India .,December,2016,April,2017,Rajiv0413,India,Asia,male,3,1,male,8
476906244_2,Taj_POS_6483_2,Its a day trip from Delhi but be warned that on weekends the ques can be long .,December,2016,April,2017,Rajiv0413,India,Asia,male,2,0,male,8
475226875_1,Taj_POS_6553_1,"We came to the city of Agra and it was so dirty full of people , and even had difficulties to stay the night over .",May,2016,April,2017,Aida_Matuleviciute,Lithuania,Europe,male,1,1,female,8
475226875_2,Taj_POS_6553_2,"and Black one on the other side , seems like its still alive .",May,2016,April,2017,Aida_Matuleviciute,Lithuania,Europe,male,3,1,female,8
475223573_1,Taj_POS_6555_1,"I have seen many pictures and heard the love story , however once I got there it just took my breath away !",April,2017,April,2017,ricky_ricardo_mx,Mexico,North America,male,1,1,male,8
474896501_1,Taj_POS_6572_1,"Everyone has seen many photos of the Taj Mahal and we were not expecting to be that impressed for some reason , but we were mightily impressed !",March,2017,April,2017,hobart_10,Australia,Oceania,male,1,1,male,88
474896501_2,Taj_POS_6572_2,"It is such a beautiful building , so perfect and symmetrical from every angle .",March,2017,April,2017,hobart_10,Australia,Oceania,male,4,2,male,88
474896501_3,Taj_POS_6572_3,Try to see it in the early morning or at sunset because the marble looks translucent and takes on a beautiful glow .,March,2017,April,2017,hobart_10,Australia,Oceania,male,3,1,male,88
474896501_4,Taj_POS_6572_4,The story behind the building of the Taj is very touching and it is well worth doing some reading about the Mughals and the history behind the building to fully appreciate it .,March,2017,April,2017,hobart_10,Australia,Oceania,male,4,2,male,88
474896501_5,Taj_POS_6572_5,"Along with that history goes Agra Fort , an incredible and huge complex with so many elements to it and we would suggest maybe seeing that before viewing the Taj Mahal as their stories are interconnected .",March,2017,April,2017,hobart_10,Australia,Oceania,male,3,1,male,88
474896501_6,Taj_POS_6572_6,It is great when you are travelling with a guide who can tell you the history and tie it all together .,March,2017,April,2017,hobart_10,Australia,Oceania,male,3,1,male,88
474133629_1,Taj_POS_6605_1,I had never bucket-listed the Taj Mahal and actually ended up visiting as part of a longer tour organised by a photography group .,February,2017,April,2017,Phil H,United Kingdom,Europe,female,1,1,male,89
474133629_2,Taj_POS_6605_2,Having visited and enjoyed the ( relative ) peace at Sunrise and watched the colours creep across the building I am so glad that we did - it really is magical despite the inherent irony .,February,2017,April,2017,Phil H,United Kingdom,Europe,female,3,1,male,89
473147178_1,Taj_POS_6647_1,"Worth the visit , must do once in lifetime at least !",April,2017,April,2017,GeethaS172,India,Asia,male,3,1,female,8
473147178_2,Taj_POS_6647_2,"Amazing architecture and gardens , just can not believe our own eyes !",April,2017,April,2017,GeethaS172,India,Asia,male,3,1,female,8
472804297_1,Taj_POS_6676_1,"Marvelous design , incomparable architecture and the vastness will blow your mind .",April,2017,April,2017,Ann S,Malaysia,Asia,male,1,1,female,94
472804297_2,Taj_POS_6676_2,Detail of everything pattern and perfection of carving without modern machines is beyond imagination .,April,2017,April,2017,Ann S,Malaysia,Asia,male,3,1,female,94
472804297_3,Taj_POS_6676_3,"can not believe one can love another this much , Taj much !",April,2017,April,2017,Ann S,Malaysia,Asia,male,1,1,female,94
472804297_4,Taj_POS_6676_4,Some tips on visiting Taj Mahal - Stay close to Taj .,April,2017,April,2017,Ann S,Malaysia,Asia,male,1,1,female,94
472804297_5,Taj_POS_6676_5,If you fancy a glimpse of the Taj without chaos or snap a sunrise be at the gates at no later than 5:30 am .,April,2017,April,2017,Ann S,Malaysia,Asia,male,1,1,female,94
472804297_6,Taj_POS_6676_6,"Try to get in through Eastern Gate , which is least crowded .",April,2017,April,2017,Ann S,Malaysia,Asia,male,1,1,female,94
472804297_7,Taj_POS_6676_7,"Checking is strict , do not carry any eatables , not even chewing gums .",April,2017,April,2017,Ann S,Malaysia,Asia,male,1,1,female,94
472804297_8,Taj_POS_6676_8,You can book online tickets to most monuments in Agra from official website .,April,2017,April,2017,Ann S,Malaysia,Asia,male,1,1,female,94
472804297_9,Taj_POS_6676_9,The evening before or after capture the beautiful Taj in sundown from Mehtab Bag .,April,2017,April,2017,Ann S,Malaysia,Asia,male,3,1,female,94
472804297_10,Taj_POS_6676_10,"Humble request - Please refrain from writing , scribbling , scratching , spitting or any action that can harm this beauty .",April,2017,April,2017,Ann S,Malaysia,Asia,male,1,1,female,94
472804297_11,Taj_POS_6676_11,it is pretty sad how time and increasing pollution has affected the structure .,April,2017,April,2017,Ann S,Malaysia,Asia,male,1,1,female,94
469911840_1,Taj_POS_6833_1,Here is some tips to enjoy the place better and avoid huge crowd - 1 .,March,2017,March,2017,korneev_sergey,Ukraine,Europe,male,2,0,male,8
469911840_2,Taj_POS_6833_2,"I was there at 8 am , and it was ok , in 1 hour the place was crowded .",March,2017,March,2017,korneev_sergey,Ukraine,Europe,male,1,1,male,8
469911840_3,Taj_POS_6833_3,"If you can afford , take a private guide , it really saves time to get through the huge entrance queue .",March,2017,March,2017,korneev_sergey,Ukraine,Europe,male,1,1,male,8
468276464_1,Taj_POS_6945_1,But expect to wait for at least 45-60 minutes before you pass the entrance .,March,2017,March,2017,EvaJ390,Norway,Europe,male,1,1,female,93
468276464_2,Taj_POS_6945_2,"That is if you come early in the morning , around 6.30 .",March,2017,March,2017,EvaJ390,Norway,Europe,male,2,0,female,93
468276464_3,Taj_POS_6945_3,"When we left around 9am , there were no one waiting to come in .",March,2017,March,2017,EvaJ390,Norway,Europe,male,1,1,female,93
468276464_4,Taj_POS_6945_4,"No food or videocameras are allowed , no backpacks , not Even small .",March,2017,March,2017,EvaJ390,Norway,Europe,male,1,1,female,93
468276464_5,Taj_POS_6945_5,You will have to go all the way back to the locker room to hand in the bag and have to payn20 rupies .,March,2017,March,2017,EvaJ390,Norway,Europe,male,2,0,female,93
468276464_6,Taj_POS_6945_6,"At the the entrance from where you can see TM , you must leave your videocamera and pay 25 rupies .",March,2017,March,2017,EvaJ390,Norway,Europe,male,1,1,female,93
468276464_7,Taj_POS_6945_7,IT is curious since most regular cameras and mobile phones also have video functions .,March,2017,March,2017,EvaJ390,Norway,Europe,male,3,1,female,93
468276464_8,Taj_POS_6945_8,"The whole area is beautiful and interesting , garden is lovely .",March,2017,March,2017,EvaJ390,Norway,Europe,male,4,2,female,93
468276464_9,Taj_POS_6945_9,"There is a museum , but IT does not open before 9am .",March,2017,March,2017,EvaJ390,Norway,Europe,male,1,1,female,93
468276464_10,Taj_POS_6945_10,"1,5 to 2 hours is enough if you did not eat breakfast .",March,2017,March,2017,EvaJ390,Norway,Europe,male,1,1,female,93
468276464_11,Taj_POS_6945_11,"I Would have preferred to start at 9 am , although this is the time for large tour groups .",March,2017,March,2017,EvaJ390,Norway,Europe,male,1,1,female,93
466852711_1,Taj_POS_7029_1,Under cleaning at moment but you can still see how spectacular this place is 6 to get in well worth money Would go back again .,March,2017,March,2017,Barry V,United Kingdom,Europe,male,3,1,male,82
466797217_1,Taj_POS_7030_1,"Our first glimpse was from the fort , early afternoon and there was a haze but when we arrived there it was wonderful and awesome , so imposing .",February,2017,March,2017,Dorothy F,United Kingdom,Europe,male,1,1,female,9
466416118_1,Taj_POS_7050_1,"So I went twice at night and day , Was mesmerized both the time , And there are so many people that come to visit and surprisingly I found it all ran so smoothly and in order , Would recommend to try be the first person to reach .",March,2017,March,2017,siddhi261,India,Asia,male,3,1,female,87
465709533_1,Taj_POS_7087_1,it is crazy to think that this magnificient building is a mausoleum .,March,2017,March,2017,SarahSwing,Cabo Verde,Africa,male,2,0,female,8
465709533_2,Taj_POS_7087_2,If you are interested in history I recommend hiring a tour guide .,March,2017,March,2017,SarahSwing,Cabo Verde,Africa,male,3,1,female,8
465709533_3,Taj_POS_7087_3,We opted for a sunrise tour and it did not disappoint !,March,2017,March,2017,SarahSwing,Cabo Verde,Africa,male,1,1,female,8
464150634_1,Taj_POS_7186_1,"This is THE INDIA sight , so take your time and enjoy the beauty .",February,2017,March,2017,JamesC337,Australia,Oceania,female,3,1,male,94
463681808_1,Taj_POS_7206_1,"A must see in Agra , it is everything I thought it would be and more .",February,2017,March,2017,MaryC4550,United Kingdom,Europe,male,3,1,female,8
463641501_1,Taj_POS_7209_1,Please do not look at their website for the times of visit .,February,2017,March,2017,Anusha_YK,Singapore,Asia,male,1,1,female,9
463641501_2,Taj_POS_7209_2,A lot of myths about the world wonder but be it a tomb or an old hindu temple destroyed by the mughals The Taj is truly magnificent and spellbinding !,February,2017,March,2017,Anusha_YK,Singapore,Asia,male,3,1,female,9
463641501_3,Taj_POS_7209_3,it is poorly maintained and the authorities are scrambling now to do their bit and not sure if its too late now .,February,2017,March,2017,Anusha_YK,Singapore,Asia,male,1,1,female,9
463641501_4,Taj_POS_7209_4,We had one useless guy and paid him 1000 rupees for nothing .,February,2017,March,2017,Anusha_YK,Singapore,Asia,male,1,1,female,9
463352684_1,Taj_POS_7227_1,"If you visit Delhi , or any other part of India within travelling distance of the Taj , make the effort to visit .",February,2017,February,2017,DavidBrittain,New Zealand,Oceania,male,1,1,male,92
463352684_2,Taj_POS_7227_2,"The experience will only be spoiled by the ongoing repair work , the hassle of guides trying guide you , the pushy crowds and the polluted river .",February,2017,February,2017,DavidBrittain,New Zealand,Oceania,male,1,1,male,92
463032415_1,Taj_POS_7240_1,This is an amazing 3D work of art - a tribute to the dedication and skill of the craftsmen of the time and the love of the King for his late wife - totally unmissable .,January,2017,February,2017,642Lorraine74,United Kingdom,Europe,male,4,2,female,9
461615852_1,Taj_POS_7316_1,there is not much to see on the inside but with its beautiful exterior who cares .,February,2017,February,2017,Michelle1O8,United States,North America,female,1,1,female,8
461615852_2,Taj_POS_7316_2,Definitely overpriced but hey one more world wonder I can take off my list !,February,2017,February,2017,Michelle1O8,United States,North America,female,3,1,female,8
460382660_1,Taj_POS_7377_1,There are so many photos and stories about the Taj Mahal that I expected to be disappointed with the real thing .,February,2017,February,2017,Eben,United Kingdom,Europe,male,1,1,male,81
460382660_2,Taj_POS_7377_2,Everything about it is so beautiful that the poverty dirt and squalor that surrounds it fades to nothing .,February,2017,February,2017,Eben,United Kingdom,Europe,male,1,1,male,81
460382660_3,Taj_POS_7377_3,"It is huge , resplendent and has an energy which lifts the mood of all who see it .",February,2017,February,2017,Eben,United Kingdom,Europe,male,3,1,male,81
460382660_4,Taj_POS_7377_4,The reality was that neither was preferable to the other but the return visit was worthwhile to reinforce the memories .,February,2017,February,2017,Eben,United Kingdom,Europe,male,1,1,male,81
460382660_5,Taj_POS_7377_5,"If I have a disappointment is was that the heavily polluted atmosphere around this beautiful building meant that views were always hazy , I am not sure whether this was a seasonal issue .",February,2017,February,2017,Eben,United Kingdom,Europe,male,0,2,male,81
460312761_1,Taj_POS_7382_1,From our first view on a slightly hazy morning ( which added to the mistique ) this is just a stunning and amazing sight .,January,2017,February,2017,EddieReid,United Kingdom,Europe,female,3,1,male,99
460312761_2,Taj_POS_7382_2,There really are no words to describe the magnificence of this and I am not going to attempt to do so .,January,2017,February,2017,EddieReid,United Kingdom,Europe,female,1,1,male,99
459640000_1,Taj_POS_7421_1,"What is there to say , other than no photo can do it justice .",February,2017,February,2017,Etta007,United Kingdom,Europe,male,1,1,female,84
459640000_2,Taj_POS_7421_2,"As you come through the red sandstone gate it floats like a mirage in front of you , surely the most beautiful building in the world .",February,2017,February,2017,Etta007,United Kingdom,Europe,male,3,1,female,84
458414535_1,Taj_POS_7484_1,The architecture is amazing and to imagine people had such advanced visions and ideas to construct such a magnificent work of art .,January,2017,February,2017,Manhattan69,Malaysia,Asia,female,3,1,female,8
458414535_2,Taj_POS_7484_2,"One tip to tourist , be sure to politely tell your guide that you DO NOT need an official photographer .",January,2017,February,2017,Manhattan69,Malaysia,Asia,female,1,1,female,8
457483132_1,Taj_POS_7542_1,The most beautiful building I have seen and I have no doubt it will be the most beautiful building I will ever see .,February,2017,February,2017,CharlotteKirsch,United Kingdom,Europe,male,4,2,female,87
457483132_2,Taj_POS_7542_2,"The tourist facility at the East Gate provides foreign nationals with a free bottle of water and shoe cover on their purchase of the ticket , so make sure you collect .",February,2017,February,2017,CharlotteKirsch,United Kingdom,Europe,male,1,1,female,87
457483132_3,Taj_POS_7542_3,The shuttle bus takes you to and from the Taj Mahal from the ticket desk .,February,2017,February,2017,CharlotteKirsch,United Kingdom,Europe,male,1,1,female,87
457483132_4,Taj_POS_7542_4,Avoid overpriced guides at the tourist ticket facility - you will get a much better deal if you wait until the very bottom and entrance to the Taj Mahal itself .,February,2017,February,2017,CharlotteKirsch,United Kingdom,Europe,male,1,1,female,87
457483132_5,Taj_POS_7542_5,Be strong and ensure they do not lure you into photography and their friends shops at expensive prices .,February,2017,February,2017,CharlotteKirsch,United Kingdom,Europe,male,3,1,female,87
457483132_6,Taj_POS_7542_6,The photographers do know the best spots and poses for photos though if you do not mind paying 50 for 50 photos printed and on CD .,February,2017,February,2017,CharlotteKirsch,United Kingdom,Europe,male,3,1,female,87
